Number,Reference,Name,Text Content,Document,Codes,Number of Codes,Comment,Start position,End position,Extent,Creator,Creation Date,Modifier,Modification Date
29:1,p 2,,ĂŵĞƐĂƐ^ƉĞĐƵůĂƚŝǀĞĞƐŝŐŶ͗ůůŽǁŝŶŐWůĂǇĞƌƐƚŽ ŽŶƐŝĚĞƌůƚĞƌŶĂƚĞWƌĞƐĞŶƚƐĂŶĚWůĂƵƐŝďůĞ&ƵƚƵƌĞƐ,Games as Speculative Design_ Allowing Players to Consider Alterna.pdf,Paper Reflection: Comment,1,"theoretical framework bringing together different theories. This paper opens questions for me. On the one hand I think they bring together theories in a nice way that is easy to read and understand. They us figures nicely and sub headings - helping you see how theories can help design. They then share their own game, and reflect on it in relation to the theories. I think this part is a bit weak. It is tempting, but not really reasonable to create a lit of ""shoulds"" from one game that you never really evaluated through an external or rigorous process.",2,2,1,Angela Rout,10/19/25,Angela Rout,10/19/25
29:2,p 2,,ŚĞ ƉĂƉĞƌ ƌĞǀŝĞǁƐ ĨƵƚƵƌĞƐ ŽƌŝĞŶƚĂƚĞĚ ĚĞƐŝŐŶ ƉƌĂĐƚŝĐĞƐ ƐƵĐŚ ĂƐ ĞƐŝŐŶ &ŝĐƚŝŽŶ͕ ^ƉĞĐƵůĂƚŝǀĞ ĞƐŝŐŶ͕ ĂŶĚ ƌŝƚŝĐĂů ĞƐŝŐŶ ĂůŽŶŐƐŝ ĚĞ ĐŽŵƉůŝŵĞŶƚĂƌǇ ƌĞƐĞĂƌĐŚ ĂƌĞĂƐ ŝŶ ŐĂŵĞƐ ƐƚƵĚŝĞƐ ƐƵĐŚ ĂƐ ƌŝƚŝĐĂů WůĂǇ͕ WĞƌƐƵĂƐŝ ǀĞ 'ĂŵĞƐ͕ ĂŶĚ WƌŽĐĞĚƵƌĂůZŚĞƚŽƌŝĐ,Games as Speculative Design_ Allowing Players to Consider Alterna.pdf,Contribution: Summative/Integrative: Literature Review,1,I believe this is a literature review,2,2,1,Angela Rout,10/19/25,Angela Rout,10/19/25
29:3,p 13,,ĞĨůĞĐƚŝŽŶƐŽŶĚĞƐŝŐŶƉƌŽĐĞƐƐ Ɛ&ƌĂǇůŝŶŐŶŽƚĞƐƚŚĞŝŶƚĞŶƚŽĨƌĞƐĞĂƌĐŚƚŚƌŽƵŐŚĚĞƐŝŐŶŝƐƚŽĐƌĞĂƚĞŶĞǁĚĞƐŝŐŶŬŶŽǁůĞĚŐĞďǇ ƌĞĨůĞĐƚŝŶŐƵƉŽŶƚŚĞƉƌŽĐĞƐƐƚŚĂƚůĞĚƚŽƚŚĞĐƌĞĂƚŝŽŶŽĨƚŚĞĂƌƚĞĨĂĐƚƌĂƚŚĞƌƚŚĂŶƚŚĞĂƌƚĞĨĂĐƚ ŝƚƐĞůĨ;&ƌĂǇůŝŶŐϭϵϵϯͿ͘/ŶƚŚŝƐƐĞĐƚŝŽŶǁĞĂƚƚĞŵƉƚƚŽĐůĂƌŝĨǇƚ ŚĞƉƌĞǀŝŽƵƐƚŚĞŽƌĞƚŝĐĂůĚŝƐĐƵƐƐŝŽŶ ĚĞǀĞůŽƉĞĚĨƌŽŵƚŚĞĚĞƐŝŐŶĂŶĚĚĞǀĞůŽƉŵĞŶƚŽĨŽůĚ^ƵŶ;ŽƵůƚŽŶĞƚ͘ĂůϮϬϭϰͿƚŽďƵŝůĚĂ ĨƌĂŵŝŶŐƚŚĂƚĐĂŶƵŶĚĞƌƉŝŶƚŚĞĐŽŶƐŝĚĞƌĂƚŝŽŶŽĨŐĂŵĞƐĂƐĂƐƉĞĐŝĨŝĐĂƉƉƌŽĂĐ,Games as Speculative Design_ Allowing Players to Consider Alterna.pdf,Transitions: Legitimize Design (Scientific),1,"here they first presenta a game they made and then reflect on how they made it. Im not a fan of this as research, per se, but I do see that this approach is an attractive way to present design as research. I think the main thing is that they do back it up with quite a discussion of different theoretical concepts and papers, to be more rigorous.",13,13,1,Angela Rout,10/19/25,Angela Rout,10/19/25
29:4,p 13,,ƌĂŵŝŶŐŽĨ'ĂŵĞƐĂƐ^ƉĞĐƵůĂƚŝǀĞĞƐŝŐŶ ϱ͘ϭ͘ϭ^ƉĞĐƵůĂƚŝǀĞ'ĂŵĞĞƐŝŐŶƐŚŽƵůĚĞŵďƌĂĐĞƚŚĞƉůƵƌĂůŝƚǇŽĨƌ ĞĂůŝƚŝĞƐŽĨďŽƚŚĚĞƐŝŐŶĞƌƐ ĂŶĚƉůĂǇĞƌƐ͘,Games as Speculative Design_ Allowing Players to Consider Alterna.pdf,Contribution: Methodological: Design,1,"here, at the end of the paper they present a series of design ""requirements"" they are ""shoulds"". this is how they get around a ""contribution"" although I feel it is a bit weak, if it is not well aligned with a systematic review of literature, projects, or processes.",13,13,1,Angela Rout,10/19/25,Angela Rout,10/19/25
30:1,p 2,,Envisioning personal finance and expense tracking for a sustainable future,Envisioning personal finance and expense tracking for a sustainab.pdf,Paper Reflection: Comment,1,a proposal for a finance/expense tracking app (UI) is made based on author's position and is tested/validated through survey questionnaire.,2,2,1,Michael Tjia,10/20/25,Michael Tjia,10/20/25
30:2,p 3,," Achieving the goals of economic self-sufficiency, environmen- tal and health sustainability, and ethical consumption altogether require farsighted planning and well-informed decisions. Current Korean and overseas personal finance apps (Table 1), however, do not effectively motivate users for the above-mentioned goals",Envisioning personal finance and expense tracking for a sustainab.pdf,Contribution: Theoretical: Opinion,1,,3,3,1,Michael Tjia,10/20/25,Michael Tjia,10/20/25
30:3,pp 3 – 4,,"ut you would not know how much
Envisioning personal finance and expense tracking for a sustainable future 3 you are allowed to spend per month without the peer group comparison and expert recom- mendation. Furthermore, we could not find any finance apps that inform users on the envi- ronmental-health impacts of energy and products the users consumed, or what to buy for ethical consumption.",Envisioning personal finance and expense tracking for a sustainab.pdf,Contribution: Practical/Applied: Digital Product,1,authors recognize gap in current market offering. design proposal aims to fill this gap,3,4,2,Michael Tjia,10/20/25,Michael Tjia,10/20/25
30:4,p 15,,"The findings are limited due to the small sample size (n=65), and the alternative UI design needs to be revised further. In the future studies, while the peer group comparison and ex- pert recommendation features were applied to the consumption category level in this study (e.g., Rent and Utilities category), the features can be revised for the specific home appli- ances level to raise a user’s awareness on the electricity consumed to run each of them, and the comparison and recommendation can function as negative feedback.",Envisioning personal finance and expense tracking for a sustainab.pdf,Transitions: Legitimize Design (Scientific),1,using quantitative studies to legitimize design decisions,15,15,1,Michael Tjia,10/20/25,Michael Tjia,10/20/25
31:1,p 2,,Designing temporal ecologies: Reframing multispecies temporalities through design,Designing Temporal Ecologies_ Reframing Multispecies Temporalitie.pdf,Paper Reflection: Comment,1,"The paper explores how time and temporality are understood and designed within more-than-human ecologies i.e. systems involving both humans and other species. It challenges the dominant Western notion that human time is linear, fast, and progressive, while nonhuman time is cyclical, slow, and separate. I find the topic of 'temporalities' interesting in relation to architectural design domain. It is one of the notions in the 'Positions' course. The results coming from interdisciplinary workshops give interesting ideas for rethinking temporalities. It is clearly due to the participant mix, including a) designers (working in the fields of ecologies, environment and bio-design), b) biologists (with research centred on evolutionary ecology and phenology), and c) environmental humanities researchers.",2,2,1,Marija Mateljan,10/22/25,Marija Mateljan,10/22/25
31:2,p 3,,"In this paper, we demonstrate ways in which design can help to mobilise this call, revealing multispecies temporal entanglements, reframing narratives of human and other-than- human temporalities, and ultimately contributing towards more sustainable ways of living. ",Designing Temporal Ecologies_ Reframing Multispecies Temporalitie.pdf,Transitions: Legitimize Design (Scientific),1,"The paper shows how design can reveal the intertwined temporalities of humans and other species, challenge dominant narratives that separate them, and support more sustainable, multispecies ways of living. The fact that these complex topics can be addressed (only) through design legitimizes it.",3,3,1,Marija Mateljan,10/22/25,Marija Mateljan,10/28/25
31:3,p 6,," interdisciplinary workshop that brought together a) designers working in the fields of ecologies, environment and biodesign, b) biologists with research centred on evolutionary ecology and phenology, and c) environmental humanities researchers. ",Designing Temporal Ecologies_ Reframing Multispecies Temporalitie.pdf,Research Method: Qualitative: Focus Groups/Workshops,1,Interdisciplinary Workshop. 4 interdisciplinary groups of 4-5 participants worked together during the workshop.,6,6,1,Marija Mateljan,10/22/25,Marija Mateljan,10/22/25
31:4,p 6,,"he goal was to conceive practical design concepts to support critical discussions on the effects of anthropogenic climate and biodiversity changes on the rhythms, evolution, and interconnectedness of multiple other-than-human species. ",Designing Temporal Ecologies_ Reframing Multispecies Temporalitie.pdf,Contribution: Methodological: Societal,1,I guess that the contribution that fits best is Method: Societal (public engagement / participation / design process). The outcome of the workshop are 4 design concepts.,6,6,1,Marija Mateljan,10/22/25,Marija Mateljan,10/28/25
31:5,p 6,,"n the second part, we used the following phrases to prompt the creation of a scenario: In a world where _____________________ , the temporality of ________________ is critical because _________________ . Design could help ____________ by ______________",Designing Temporal Ecologies_ Reframing Multispecies Temporalitie.pdf,,0,"We are using this kind of templates when asking students to describe their phenomenon of interest, position and design idea.",6,6,1,Marija Mateljan,10/22/25,ATLAS.ti,10/22/25
31:6,p 6,,each group suggested practical design concepts ,Designing Temporal Ecologies_ Reframing Multispecies Temporalitie.pdf,,0,Output: practical design concepts.,6,6,1,Marija Mateljan,10/22/25,Marija Mateljan,10/22/25
31:7,p 17,,"rompt designers to help reveal multiple expressions of time in the world, also revealing the intricacies of temporal relationships and negotiations in the everyday. Looking at expressions of social time, they suggest that this process would include following steps of “1) identifying dominant narratives of time, including identifying what helps to sustain and what is sustained by them, 2) challenging their dominance, e.g. by revealing more nuanced expressions of time; 3) drawing attention to alternative temporalities, their dynamics and significance, while 4) exposing networks of temporalities, illustrating multiplicity and variety.”",Designing Temporal Ecologies_ Reframing Multispecies Temporalitie.pdf,Transitions: Legitimize Design (Scientific),1,Design as a tool to expose hidden realities.,17,17,1,Marija Mateljan,10/22/25,Marija Mateljan,10/22/25
32:1,p 2,,Hidden public spaces: when a university campus becomes a place for communities,Hidden public spaces_ when a university campus becomes a place fo.pdf,Paper Reflection: Comment,1,"they present toolkits for public space mini-design interventions and they test it with a case study, interviews, and surveys to get feedback.",2,2,1,Angela Rout,10/27/25,Angela Rout,10/27/25
32:2,p 2,,n this paper we will describe the need to open-up hidden (unknown) public spaces like the Milano Bovisa Durando campus and the idea that through small rapid design experiments we can immediately test the efficacy of tools made to enable people’s and communities’ use of the public spac,Hidden public spaces_ when a university campus becomes a place fo.pdf,Contribution: Methodological: Design,1,maybe an idea to immediately test tools in public space?,2,2,1,Angela Rout,10/27/25,Angela Rout,10/27/25
32:3,p 6,,t the heart of this process is five-day workshop for design students ending in a one-day event to test the ideas immediately. ,Hidden public spaces_ when a university campus becomes a place fo.pdf,Research Method: Qualitative: Focus Groups/Workshops,1,they did a workshop,6,6,1,Angela Rout,10/27/25,Angela Rout,10/27/25
32:4,p 7,,"An immersion took place in the social/public places of Bovisa, including schools, local associations, public services, libraries, parks etc. From this mapping it became clear that public areas that involve the whole community are missing and the existing social places are related to specific communities and are semi-private",Hidden public spaces_ when a university campus becomes a place fo.pdf,Research Method: Mixed-methods,1,they also did some mapping,7,7,1,Angela Rout,10/27/25,Angela Rout,10/27/25
32:5,p 12,,"collected by interviews, surveys and active observation on the day",Hidden public spaces_ when a university campus becomes a place fo.pdf,Research Method: Qualitative: Interviews,1,,12,12,1,Angela Rout,10/27/25,Angela Rout,10/27/25
32:6,p 12,,The surveys/interviews asked mainly: x if people could see themselves coming more frequently to the campus to use it for their own activities or enjoying the activities provided,Hidden public spaces_ when a university campus becomes a place fo.pdf,Research Method: Quantitative: Survey/Questionnaire,1,,12,12,1,Angela Rout,10/27/25,Angela Rout,10/27/25
33:1,p 2,,Governance in silico: Experimental sandbox for policymaking over AI Agents,Governance in Silico_ Experimental Sandbox for Policymaking over.pdf,Paper Reflection: Comment,1,"This paper has an interesting topic but also odd fomat. they focus on simulations of people in stakeholder process an they see that working with simulations actually can make participants more aware theo their own policy needs or failures. Their method was to develop an AI and run a pilot study and then report their opinions. It isn't rigorous, and the findings are loose but seems that they have an interesting enough topic that this softer process is still interesting enough to publish. I think there should be a place for pilot studies, and a place to reflect and share things that are in-progress, so that is good. But yet does it de-legtimise design if papers are not rigorous?",2,2,1,Angela Rout,10/19/25,Angela Rout,10/19/25
33:2,p 2,,"To explore the prompts' engagement qualities, we conducted a pilot study on co-designing AI agents for negotiating con- tested aspects of the EU Artificial Intelligence Act (EU AI Act). ",Governance in Silico_ Experimental Sandbox for Policymaking over.pdf,Contribution: Methodological: Design,1,I am trying to figure out the contribution but I think it is a co-design method for designing AI agents,2,2,1,Angela Rout,10/19/25,Angela Rout,10/19/25
33:3,p 3,,"ore the potential for integrating political representation and agency in synthetic con- tent and data, we leveraged the capabilities of Generative Artificial Intelligence (GAI) to sim- ulate demographic and behavioral data through AI agents. By conducting pilot studies of AI agent simulations of stakeholder participation and representation based on engagement, we demonstrated the importance of human values such as agency, autonomy, and dignity alongside the technological pursuit of predictability and automation",Governance in Silico_ Experimental Sandbox for Policymaking over.pdf,Transitions: Digital Tech Connections,1,"well I am still confused - they is AI agents to simulate people - to prove that we need people? or something... still figuring out but this paper is certainly about digitilisation and trying to work with AI in human-centered and humanistic, messy processes",3,3,1,Angela Rout,10/19/25,Angela Rout,10/19/25
33:4,p 4,,"The exploratory sandbox for interaction between synthetic agents and real stakeholders critically evaluates the AI generated content which is also co-designed over the prompts defined by the stakeholders defining the AI agents’ simulations. In this sense, AI agents in the sandbox serve as an exploratory and ancillary tool for negotiations and deci- sions on how much and what type of automation, prediction, or synthetic content we feel comfortable to integrate in our policy processes",Governance in Silico_ Experimental Sandbox for Policymaking over.pdf,Transitions: Digital Tech Connections,1,"novel and a bit weird way to use AI, and this paper presented a different way to work with digital in human-based settings. not sure about the study design or reporting yet",4,4,1,Angela Rout,10/19/25,Angela Rout,10/19/25
33:5,p 8,,"n our opinion,",Governance in Silico_ Experimental Sandbox for Policymaking over.pdf,Transitions: Legitimize Design (Scientific),1,"This paper has a lot of personal opinion, not sure if this is useful or Legitimising design, but it did get published so that I guess is a win",8,8,1,Angela Rout,10/19/25,Angela Rout,10/19/25
34:1,p 2,,Graphic design and artificial intelligence: Interdisciplinary challenges for designers in the search for research collaboration,Graphic design and artificial intelligence_ Interdisciplinary cha.pdf,Paper Reflection: Comment,1,"Authors claim the profession of graphic design has been subjected to multiple technological shifts before. This now reoccurs again in the form of AI. Authors find there is a scarcity of scholarly engagement on this topic from practicing graphic designers versus computer science communites. Authors call for more engagement from and with graphic designers with their own practice, as well as the professionals/academics concerned with digital automation and AI.",2,2,1,Michael Tjia,10/17/25,Michael Tjia,10/17/25
34:2,p 5,,"This reinforces a two-tiered system of graphic designer; one creative and conceptual, the other a template-driven implementer.",Graphic design and artificial intelligence_ Interdisciplinary cha.pdf,"Contribution: Empirical: Society, Contribution: Methodological: Research",2,2 types of graphic designer: creative/conceptual vs. template-driven implementer,5,5,1,Michael Tjia,10/17/25,Michael Tjia,10/17/25
34:3,p 5,,"With in-house graphic design work often described as uncreative and dull (Baker, 2008; Brown, 2014; Flavin, 2017), it becomes easy to envisage the attraction for industry of machine generated solutions for in-house, corporate, or other less creative graphic design environments and outputs. ",Graphic design and artificial intelligence_ Interdisciplinary cha.pdf,Contribution: Theoretical: Opinion,1,"Authors propose a division into 2 graphic designer roles: ""one creative and conceptual, the other a template-driven implementer."" the latter is attractive to automate with AI.",5,5,1,Michael Tjia,10/17/25,Michael Tjia,10/17/25
34:4,p 9,,Figure 2. Someday the twain shall meet: methodological challenges for graphic design and ICT practices in AI,Graphic design and artificial intelligence_ Interdisciplinary cha.pdf,Contribution: Theoretical: Conceptual Framework,1,authors differentiate high-level and low-level tasks,9,9,1,Michael Tjia,10/17/25,Michael Tjia,10/17/25
34:5,p 10,,Interdisciplinary challenges,Graphic design and artificial intelligence_ Interdisciplinary cha.pdf,Contribution: Summative/Integrative: Literature Review,1,"literature reviews: graphic design research gap, graphic design professional challenges",10,10,1,Michael Tjia,10/17/25,Michael Tjia,10/17/25
34:6,p 11,,4.1 Graphic design research challenges,Graphic design and artificial intelligence_ Interdisciplinary cha.pdf,,0,,11,11,1,Michael Tjia,10/17/25,Michael Tjia,10/17/25
34:7,p 13,,"computer science AI scholars and their research may benefit from collaboration with graphic designers. Albeit, this may require acknowledging the interdisciplinary challenges discussed in this article and adopting (and adapting) practice-specific methodologies accordingly.",Graphic design and artificial intelligence_ Interdisciplinary cha.pdf,"Transitions: Academic Community, Transitions: Digital Tech Connections",2,"authors call for interdisciplinary community between graphic designers, computer science, practitioners, and academics.",13,13,1,Michael Tjia,10/17/25,Michael Tjia,10/17/25
35:1,p 2,,Inclusive Design Museums and Social Design,Inclusive Design Museums and Social Design.pdf,Paper Reflection: Comment,1,"This paper follows a format commonly found in architectural research. It examines design museums as a building type and argues that they function as agents of social inclusion. By analyzing case studies from Asia, it challenges Eurocentric perspective. The study is theoretically grounded, drawing on a specific framework, and includes a contextual analysis that traces the historical development of design museums and their shift toward visitor-centered, inclusive practices.",2,2,1,Marija Mateljan,10/22/25,Marija Mateljan,10/27/25
35:2,p 2,,this thesis argues that design museums can be seen as a form of social design to deal with social exclusion.,Inclusive Design Museums and Social Design.pdf,Contribution: Theoretical: Conceptual Framework,1,Reframes design museums as a form of social design rooted in inclusivity. Uses 2 case studies as examples of this. Or is this an Opinion?,2,2,1,Marija Mateljan,10/27/25,Marija Mateljan,10/28/25
35:3,p 2,,wo Asian design museums,Inclusive Design Museums and Social Design.pdf,Research Method: Qualitative: Case Studies,1,Use two museums as evidence for their claim.,2,2,1,Marija Mateljan,10/27/25,Marija Mateljan,10/28/25
35:4,p 2,,se design as an assistive approach to achieve the goal of social inclusiveness,Inclusive Design Museums and Social Design.pdf,Transitions: Legitimize Design (Scientific),1,Explaining how design is used to achieve something legitimizes it?,2,2,1,Marija Mateljan,10/27/25,Marija Mateljan,10/28/25
35:5,p 3,,discusses two museums in Asia that use design as an assistive approach to achieve the goal of social inclusiveness and to what extent they achieve their objectives. These two museums were founded in recent years and both do not have collections. Their focus thereby places on the engagement of their local communities. ,Inclusive Design Museums and Social Design.pdf,Research Method: Qualitative: Case Studies,1,"Examines two recently established Asian design museums that: (1) do not have permanent collections, and (2) focus on community engagement and inclusion through design.",3,3,1,Marija Mateljan,10/27/25,Marija Mateljan,10/27/25
35:6,p 3,,Musealization ,Inclusive Design Museums and Social Design.pdf,,0,weird word,3,3,1,Marija Mateljan,10/27/25,Marija Mateljan,10/27/25
35:7,p 12,,"Different from the well-established design museums that feature design collections made by famous designers, the former lasted less than a year and showcased works by marginalized groups in nomadic exhibitions; while the latter does not have collection and performs as a new museum practice that engages with communities with reverse thinking of going out of the organization. Both follow a socially inclusive philosophy and goal to engage their communities with design as a vehicle.",Inclusive Design Museums and Social Design.pdf,"Transitions: Academic Community, Transitions: Legitimize Design (Scientific)",2,"I chose the code 'Legitimize Design' because design is seen as a vehicle (method) for doing something, which implicitly legitimizes design as a method in a scientific sense. Another code could be 'Academic Community' because it engages non-Eurocentric communities and views.",12,12,1,Marija Mateljan,10/27/25,Marija Mateljan,10/27/25
36:1,p 2,,Human-centered AI: The role of Human-centered Design Research in the development of AI,Human-centered AI_ The role of Human-centered Design Research in.pdf,Paper Reflection: Comment,1,"a philosophical paper about HCD and AI and gives a serise of diagrams that illustrate different ideas of human centered design, and then proposes a framework for human centered design in AI",2,2,1,Angela Rout,10/27/25,Angela Rout,10/27/25
36:2,p 2,,The paper argues that humanistic design research should play a vital role in the pan-disciplinary collaboration with technologists and policymakers to mitigate the impact of AI. U,Human-centered AI_ The role of Human-centered Design Research in.pdf,Contribution: Theoretical: Opinion,1,they contribute an argument?,2,2,1,Angela Rout,10/27/25,Angela Rout,10/27/25
36:3,p 2,,uman-centered Artificial Intelligence incorporates involving people and designing Artificial Intelligence systems for people through a genuine human-centered philosophy and approach.,Human-centered AI_ The role of Human-centered Design Research in.pdf,Transitions: Digital Tech Connections,1,"using human-centred design as a framework to think about AI, using existing well established non digital methods to reframe new tech",2,2,1,Angela Rout,10/27/25,Angela Rout,10/27/25
36:4,p 3,,"This article discusses two different philosophical perspectives in AI, the rationalistic and design perspective (Winograd, 1996). This discussion is followed by examining these different perspectives and their implications in guiding the development and application of human-centered AI. T",Human-centered AI_ The role of Human-centered Design Research in.pdf,Research Method: Qualitative: Content Analysis,1,perhaps it is content analysis - a philosophical review of ideas and then proposing new ideas,3,3,1,Angela Rout,10/27/25,Angela Rout,10/27/25
37:1,p 3,,Impacting literacy through the power of a font: Transdisciplinary research for inclusive reading experiences,Impacting literacy through the power of a font_ Design research f.pdf,Paper Reflection: Comment,1,"another pilot study with less than rigorous processes. They are basically sharing a ""work in progress"". they crated a pretty cool font, did a small pilot study, saw some preliminary success, and are now building a website, and more materials. they have not yet tested these results, and so hard to actually justify the title ""Impacting Literacy"". Yet it is nice to see this kind of in-progress work. And also to build community while the project is ongoing.",3,3,1,Angela Rout,10/19/25,Angela Rout,10/19/25
