Number,Reference,Name,Text Content,Document,Codes,Number of Codes,Comment,Start position,End position,Extent,Creator,Creation Date,Modifier,Modification Date
11:11,p 17,,"To quantify the results of the rankings, we encoded the first rank as 3 points, the second rank as 2 points, and the last rank as 1 point, then calculated the mean and variance for each group. The average scoring results are displayed in Table 5. Furthermore, we used paired sample t-tests to calculate the significant differences between the groups, with the p-values shown in Table 6. For feasibility, the ground truth group received the highest average score (Mean=2.06, SD=0.21), followed by the concept generator group (Mean=2.03, SD=0.16), which was slightly lower than the ground truth group. Both of these two groups scored higher than the control group, with significant differences (p = 0.034 and p = 0.031). Addi- tionally, the paired T-test between the ground truth and concept generator group showed no significant difference (p = 0.709). As for novelty, the scores of the three groups were rela- tively close, with no significant differences (all values exceeded 0.05). However, the mean score of the concept generator group (Mean=2.01, SD=0.25) was also higher than that of the control group (Mean=1.91, SD=0.20). ",An Llm-based Concept Generation Method for Solution-driven Bio-in.pdf,Research Method: Quantitative: Experimental Research,1,"UM... this method is very questionable, this is Likert scale data which is ordinal and you should not compare results like this, or do averages with the results. the best you can do is present the visualisations",17,17,1,Angela Rout,10/17/25,Angela Rout,10/17/25
11:12,p 18,,Results of paired samples t-test.,An Llm-based Concept Generation Method for Solution-driven Bio-in.pdf,Transitions: Legitimize Design (Scientific),1,"here they do a t-test on qualitative data and seems overkill for the topic, but then here they are trying to sound scientific on something. Also I have a hunch the authors are engineers.",18,18,1,Angela Rout,10/17/25,Angela Rout,10/17/25
12:1,p 2,,An analysis of design maturity models used in design organizations,An analysis of design maturity models used in design organization.pdf,Paper Reflection: Comment,1,authors discuss 3 categories of maturity models in design organisations: models to help assess key performance metrics. submission feels very design -business-y and theoretical.,2,2,1,Michael Tjia,10/27/25,Michael Tjia,10/27/25
12:2,p 2,,Design maturity frameworks are intended to provide key performance metrics and milestones for organizations to assess the effectiveness of design practices and user research in their processes and products. ,An analysis of design maturity models used in design organization.pdf,Transitions: Legitimize Design (Scientific),1,,2,2,1,Michael Tjia,10/27/25,Michael Tjia,10/27/25
12:3,p 4,,rkplace practices during the pandemic era with keynote speakers highlighting their organizational needs and reviewed maturity models that work best for their present situation. The data collected from the industry conferences and literature review provided a good collection of maturity frameworks that were presented by industry veterans and practicing designers. The generic models catalogued from our search in the design industry space provided different mo,An analysis of design maturity models used in design organization.pdf,"Contribution: Methodological: Research, Research Method: Mixed-methods",2,an alternative to (scientific) literature review,4,4,1,Michael Tjia,10/27/25,Michael Tjia,10/27/25
12:4,p 5,,development surveyed thousands of companies and interviewed 2200 designers around the globe to understand the relationship between design practices and business performance. The company ge,An analysis of design maturity models used in design organization.pdf,Contribution: Theoretical: Conceptual Framework,1,"the models are presented as a framework to measure ""design maturity"". they are mentioned, but context is not provided, the author refers to previous research work",5,5,1,Michael Tjia,10/27/25,Michael Tjia,10/27/25
12:5,p 13,,"Successful implementation of a maturity framework can also inform competency development in professional design education and curriculum, creating a better alignment between academic training and job roles in the design industry.",An analysis of design maturity models used in design organization.pdf,Transitions: Academic Community,1,authors hope to improve alignment between academic training and professional roles in design industry,13,13,1,Michael Tjia,10/27/25,Michael Tjia,10/27/25
12:6,p 14,,"We hope this paper can help organizations adopt, customize, evaluate, and enhance these maturity frameworks for effective adoption of design practices in their organization, design maturity growth and organizational change. Future studies can lead to empirically testing the effectiveness of implementing different versions these models at workplace and tracking the maturity growth over a time period.",An analysis of design maturity models used in design organization.pdf,Transitions: Legitimize Design (Scientific),1,"authors hope for empirical testing performance of ""maturity models"" in workplaces",14,14,1,Michael Tjia,10/27/25,Michael Tjia,10/27/25
13:1,p 2,,Card-based Tools for Creative and Systematic Design,Card-based Tools for Creative and Systematic Design.pdf,Paper Reflection: Comment,1,"The paper examines card-based design tools — sets of cards used to support design activities across various fields, including user experience (UX) design, human-centered design, engineering, and software design. These cards are intended to stimulate creativity or provide design guidance. The authors analyze how such tools have evolved and operate in different design contexts, offering a critical assessment of their functions and effectiveness, which leads to a new categorization of card-based tools. They argue that while these tools can be valuable in academic or educational settings, they have limited impact in real-world design practice.",2,2,1,Marija Mateljan,10/22/25,Marija Mateljan,10/22/25
13:2,p 2,,nalysis of 72 card-based design tools produced a new classification and also identified that the tools work in several different ways – e.g. offering creative stimuli or summaries of design methods.,Card-based Tools for Creative and Systematic Design.pdf,Contribution: Theoretical: Conceptual Framework,1,"They propose a new categorization or taxonomy for card-based design tools, since prior attempts lacked consistency and were based on limited data.",2,2,1,Marija Mateljan,10/21/25,Marija Mateljan,10/21/25
13:3,p 2,,"Often these tools are used and tested by those who developed them. Hence, more independent, controlled trials are needed to help establish their practical effectiveness.",Card-based Tools for Creative and Systematic Design.pdf,Transitions: Legitimize Design (Scientific),1,"The authors approach ‘cards’ from a cumulative, analytical perspective, aiming to frame them within a more scientific discourse. While cards as tools support idea generation, evidence of their practical impact is limited. This is because most evaluations rely on self-assessment by card creators. Authors highlight the need for independent, controlled studies to verify their effectiveness (in a more scientific way).",2,2,1,Marija Mateljan,10/21/25,Marija Mateljan,10/28/25
13:4,p 2,,"The House of Cards created in 1952 by the famous American designers, Charles and Ray Eames",Card-based Tools for Creative and Systematic Design.pdf,,0,architectural cards,2,2,1,Marija Mateljan,10/21/25,ATLAS.ti,10/21/25
13:5,p 3,,elp inspire design ideas. ,Card-based Tools for Creative and Systematic Design.pdf,,0,role of cards,3,3,1,Marija Mateljan,10/28/25,Marija Mateljan,10/28/25
13:6,p 3,,"strategies and methods for correctly identifying problems, widening the search space, overcoming mental blocks,",Card-based Tools for Creative and Systematic Design.pdf,,0,role of cards,3,3,1,Marija Mateljan,10/21/25,Marija Mateljan,10/28/25
13:7,p 3,,"challenging constraint, were aimed at helping artists, especially musicians, to overcome creative blocks, ",Card-based Tools for Creative and Systematic Design.pdf,,0,role of cards,3,3,1,Marija Mateljan,10/21/25,Marija Mateljan,10/28/25
13:8,p 4,,enerate successful ideas.,Card-based Tools for Creative and Systematic Design.pdf,,0,role of cards,4,4,1,Marija Mateljan,10/21/25,Marija Mateljan,10/28/25
13:9,p 4,, card game to enable designers and users to analyse and redesign task flows in software systems to make them easier and more efficient to use. ,Card-based Tools for Creative and Systematic Design.pdf,,0,role of cards,4,4,1,Marija Mateljan,10/21/25,Marija Mateljan,10/28/25
13:10,p 4,,"aimed at helping designers to create user- friendly websites, apps, screen interfaces, etc.",Card-based Tools for Creative and Systematic Design.pdf,,0,role of cards,4,4,1,Marija Mateljan,10/21/25,Marija Mateljan,10/28/25
13:11,p 4,,ays to empathize with people in design projects.,Card-based Tools for Creative and Systematic Design.pdf,,0,role of cards,4,4,1,Marija Mateljan,10/21/25,Marija Mateljan,10/28/25
13:12,p 4,,aids to team building and collaborative working and cards to stimulate and inform futures thinking,Card-based Tools for Creative and Systematic Design.pdf,,0,role of cards,4,4,1,Marija Mateljan,10/21/25,Marija Mateljan,10/28/25
13:13,p 5,,"we identified only 32 that could be considered as design tools, the rest being cards to help or provide information in areas such as personal growth, travel and sustainable living.",Card-based Tools for Creative and Systematic Design.pdf,Research Method: Qualitative: Content Analysis,1,They reviewed a large set of cards from which they selected some for their analysis based on specific criteria.,5,5,1,Marija Mateljan,10/21/25,Marija Mateljan,10/28/25
13:14,p 6,,"We compiled this from several sources: our historical survey; the Deckaholic library; the five reviews mentioned above; our own collection; and papers discussing individual card sets (e.g. Golembewski and Selby, 2010). We then analysed this inventory of 72 card-based design tools.",Card-based Tools for Creative and Systematic Design.pdf,Research Method: Qualitative: Content Analysis,1,They conducted a Literature review / tool Survey: collection and review of 72 existing card-based design tools from various sources. They then systematically analyzed features and purposes to derive categories and identify patterns.,6,6,1,Marija Mateljan,10/21/25,Marija Mateljan,10/21/25
13:15,p 9,,university produced card sets have generally been trialled by their authors in educational or experimental settings; while the consultant produced tools have tended to be used by the consultants themselves or when working with their clients. ,Card-based Tools for Creative and Systematic Design.pdf,,0,"Application of cards in educational and other specific settings, not in practice",9,9,1,Marija Mateljan,10/21/25,Marija Mateljan,10/28/25
13:16,p 12,,"card-based tools that are most likely to lead to practical design outcomes are those which summarise domain-specific design methods, or good practice guidelines, which designers can apply to real world tasks.",Card-based Tools for Creative and Systematic Design.pdf,,0,conclusion: which types of cards are the most useful,12,12,1,Marija Mateljan,10/21/25,Marija Mateljan,10/28/25
14:1,p 2,,From inspiration to conceptualization: Investigating the use of Generative AI in fashion design for early- stage concept visualization,AI as a Catalyst for Creativity_ Exploring the Use of Generative.pdf,Paper Reflection: Comment,1,another user evaluation of an AI tool - quantitative emphasis,2,2,1,Angela Rout,10/27/25,Angela Rout,10/27/25
14:2,p 2,,"Our research aims to uncover the intricate rela- tionship between designers' creative intent and the outcomes generated through prompt technology. Furthermore, we investigate how these outcomes influence the decision-making process at the conceptual stage of fashion design",AI as a Catalyst for Creativity_ Exploring the Use of Generative.pdf,Contribution: Methodological : Software,1,they examine use of AI in fashion conceptual design,2,2,1,Angela Rout,10/27/25,Angela Rout,10/27/25
14:3,p 10,,"or Experiment 1, we had a 10-minute AI introduction section before the experi- ment. In this section, we showed our participants a text-to-image experiment and an image- to-image experiment using Midjourney. This formal study consisted of 3 steps: warm-up ex- ercises (10 minutes), an AI drawing section (5-40 minutes) with the help of Midjourney, de- pending on when the designer reached the desired AI output, later with an in-depth inter- view (about 20 minutes) shown in Figure 4",AI as a Catalyst for Creativity_ Exploring the Use of Generative.pdf,Research Method: Quantitative: Experimental Research,1,it is a user study but they structure like an experiment.,10,10,1,Angela Rout,10/27/25,Angela Rout,10/27/25
14:4,p 11,,"We then conducted an online survey via Google Form7 to gather feedback from fashion and design practitioners by snowball sampling. In the survey, Designers were presented with images and phrases and asked to assess their alignment (Conwell & Ullman, 2022; Lee & Lin, 2023).",AI as a Catalyst for Creativity_ Exploring the Use of Generative.pdf,Research Method: Quantitative: Survey/Questionnaire,1,,11,11,1,Angela Rout,10/27/25,Angela Rout,10/27/25
14:5,p 23,,"By addressing the importance of prompt engineering, and the identification of the critical factors that influence designers’ decision-making, we aim to advance the understanding of how fashion designers work, drive the development of generative design initiatives, and ultimately serve as a valuable resource for researchers seeking to bridge the gap between AI and the futuristic fashion design process.",AI as a Catalyst for Creativity_ Exploring the Use of Generative.pdf,Transitions: Digital Tech Connections,1,prompt engineering and focusing on how people create prompts is an interesting way to explore how people relate to new technology,23,23,1,Angela Rout,10/27/25,Angela Rout,10/27/25
15:1,p 2,,Co-design for change: Propositions and dilemmas,Co-design for change_ Propositions and dilemmas.pdf,Paper Reflection: Comment,1,"this seems quite an open paper. It is by a Delft urbanism professor, Geertje, I know her, so that is always interesting. I think it might be more a positions paper but lets see",2,2,1,Angela Rout,10/17/25,Angela Rout,10/17/25
15:2,p 2,,"A literature review was conducted, and twelve co-design propositions were identified after quali- tative analysis.",Co-design for change_ Propositions and dilemmas.pdf,Contribution: Summative/Integrative: Literature Review,1,"in the end this is a literature review, with some broader applications and insights",2,2,1,Angela Rout,10/17/25,Angela Rout,10/17/25
15:3,p 2,,o-design propositions conflict because they align with an idealistic versus a realistic perspective,Co-design for change_ Propositions and dilemmas.pdf,Transitions: Legitimize Design (Scientific),1,I think that actually being very specific about challenges designers face is a good way to legitimise the research - it gives a helpful starting point and a rationale for why research is important,2,2,1,Angela Rout,10/17/25,Angela Rout,10/17/25
15:4,p 2,,"Contemporary societies are confronted with complex challenges, including climate change, conflicts, cybercrime, and the rising prevalence of chronic diseases. Coming up with ade- quate solutions requires the involvement of all stakeholders, as suggested by the 17th Sus- tainable Development Goal “Partnerships for the Goals.” In the past decades, co-design has emerged as a prominent approach for co-developing interventions aimed at fostering social change and solutions to societal problems (Blackwell et al., 2017; Eyles et al., 2016; Gooch et al., 2021; C. N. Harrington et al., 2018; Wang et al., 2022). Co-design is a collaborative ap- proach that actively engages end-users and key stakeholders in the design process for change (Burkett, 2012) and holds promise to develop effective and contextually relevant so- lutions.",Co-design for change_ Propositions and dilemmas.pdf,Transitions: Legitimize Design (Scientific),1,"I find these intros quite funny - they take a big problem like climate change and by the end of the paragraph somehow design in their little study can help. Its nice, but also sometimes a bit overstated. I think it is definitely an attempt to legitimise design and frame it as a way to address big problems.",2,2,1,Angela Rout,10/17/25,Angela Rout,10/17/25
15:5,p 3,,"Yet, a cross-disciplinary review and reflection on co-design prop- ositions, guidelines and heuristics that support change is lacking. ",Co-design for change_ Propositions and dilemmas.pdf,Transitions: Academic Community,1,"in a way doing reviews is, in itself, a way to build community, it is also a sign that a topic has matured to the point where there is enough literature to actually review it. Scientific formats like research papers make this easier to accomplish, even if they lack the diversity and designerly qualities of other formats",3,3,1,Angela Rout,10/17/25,Angela Rout,10/17/25
15:6,p 4,,"A literature search was conducted with the search string ((“Co-design” OR “Co-creation” OR “Participatory Design” OR “Participatory action research” OR “community-based participa- tory research”) AND (“propositions” OR “guidelines” OR “heuristics”)) on 11th August 2023 for any literature before the search date with Google Scholar. The inclusion criteria are that the article is peer-reviewed, with accessible full-text, and written in English.",Co-design for change_ Propositions and dilemmas.pdf,"Contribution: Summative/Integrative: Literature Review, Transitions: Legitimize Design (Scientific)",2,well here is a lit review and their method. Definitely legitimised design to see so many papers to be studied in a specific topic,4,4,1,Angela Rout,10/17/25,Angela Rout,10/17/25
15:7,p 5,,"3.1 Propositions Twelve propositions were identified from the literature. As outlined before, these are cate- gorized into propositions following an idealist perspective (in short: idealist propositions) and propositions following a realist perspective (in short: realist propositions). ",Co-design for change_ Propositions and dilemmas.pdf,Research Method: Qualitative: Content Analysis,1,"well, here is a lit review that does a similar thing we are doing - looks for tone, language, and perspective. They use the term ""propositions"" to frame the different categories. It ends up being a little philosophical. They present their results as a table which is something we can also do",5,5,1,Angela Rout,10/17/25,Angela Rout,10/17/25
15:8,p 13,,Figure 8 The dilemma Solution-oriented vs Problem-oriented to compromise a realistic proposition over two idealistic propositions or the other way around. ,Co-design for change_ Propositions and dilemmas.pdf,Transitions: Legitimize Design (Scientific),1,"I actually really like these diagrams, they do a really nice job of making something difficult, very clear. They are an interesting way to present results of a lit review. Overall I like they way they present their findings here and I need to remember this for our paper.",13,13,1,Angela Rout,10/17/25,Angela Rout,10/17/25
16:1,pp 1 – 2,,"Design Research SocietyDesign Research Society DRS Digital LibraryDRS Digital Library DRS Biennial Conference Series DRS2016 - Future Focused Thinking Jun 17th, 12:00 AM Could LEGO® Serious Play® be a useful technique for product coCould LEGO® Serious Play® be a useful technique for product co - design?- design? Julia Anne GardeUniversity of Twente Mascha Cecile van der VoortUniversity of Twente Follow this and additional works at: https://dl.designresearchsociety.org/drs-conference-papers CitationCitation Garde, J., and van der Voort, M. (2016) Could LEGO® Serious Play® be a useful technique for product co - design?, in Lloyd, P. and Bohemia, E. (eds.), Future Focused Thinking - DRS International Conference 2016, 27 - 30 June, Brighton, United Kingdom. https://doi.org/10.21606/drs.2016.24 This Research Paper is brought to you for free and open access by the Conference Proceedings at DRS Digital Library. It has been accepted for inclusion in DRS Biennial Conference Series by an authorized administrator of DRS Digital Library. For more information, please contact DL@designresearchsociety.org.
This work is licensed under a Creative Commons Attribution-Non Commercial 4.0 International License. Could LEGO® Serious Play® be a useful technique for product co-design?",Could LEGO® Serious Play® be a useful technique for product co -.pdf,Paper Reflection: Comment,1,"review of LEGO Serious Play as a ""technique for product co-design"" using 2 case studies",1,2,2,Michael Tjia,10/17/25,Michael Tjia,10/17/25
16:2,p 6,,Six student design teams of 3 to 4 members (all Master students Industrial Design Engineering) participated in a half-day LSP workshop that aimed at developing future product experiences. ,Could LEGO® Serious Play® be a useful technique for product co -.pdf,Research Method: Qualitative: Case Studies,1,"Two case studies include students to design a given brief/experience, and expressing their ideas with LEGO Serous Play",6,6,1,Michael Tjia,10/17/25,Michael Tjia,10/17/25
16:3,p 14,,This study explored whether LSP could be successfully applied within product design to reveal visions of (ideal) future product experiences together with potential future users. L,Could LEGO® Serious Play® be a useful technique for product co -.pdf,Contribution: Methodological: Design,1,Exploration of how LSP can be applied in a product design (education) context,14,14,1,Michael Tjia,10/17/25,Michael Tjia,10/17/25
16:4,p 17,,The strongest aspects of LSP are the fully developed step-by- step approach as well as the power of LEGO® to level the playing field and enable all participants to contribute. W,Could LEGO® Serious Play® be a useful technique for product co -.pdf,Transitions: Academic Community,1,LEGO Serious Play as a tool (leveling playing field) for collaboration between designers and non-designers.,17,17,1,Michael Tjia,10/20/25,Michael Tjia,10/20/25
17:1,p 2,,Co-creating pluralistic futures: A systematic literature review on participatory speculative design,Co-creating pluralistic futures_ A systematic literature review o.pdf,Paper Reflection: Comment,1,"This paper is about participatory speculative design (PSD) aimed at exploring complex socio-technical challenges. Unlike traditional speculative design, which focuses mainly on future artifacts, this approach emphasizes the process of co-creation, empowering participants to imagine and shape multiple potential futures.  The paper is well structured. It clearly explains the background of the topic and outlines the methods step by step, always including a short introduction and then elaboration of each segment.",2,2,1,Marija Mateljan,10/22/25,Marija Mateljan,10/22/25
17:2,p 2,,"outlines three practical pathways of participatory speculative design, which are characterized as ""technical speculation,"" ""social speculation,"" and ""integrated speculation,"" along with seven participatory methods that can be used in the design process. Finally, the study proposed a frame- work for participatory speculative design flow, delineating four phases to guide the practice of participatory speculative design. ",Co-creating pluralistic futures_ A systematic literature review o.pdf,Contribution: Methodological: Societal,1,"Paper offers 3 main practical pathways for participatory speculative design, describes 7 participatory methods that can be used within these pathways to engage participants in the design process, and proposes a workflow with 4 phases to guide the process. The urgency is the complexity of real world problems. The designer's role is to bridge gaps and connect various stakeholders.",2,2,1,Marija Mateljan,10/21/25,Marija Mateljan,10/21/25
17:3,p 2,,"complex socio-technical challenges in the real world, which may involve potential moral, cultural, social, and political implications for humanity, such as conflicts between AI automation technology and employment, controversies over gene editing technology and social ethics, and so on",Co-creating pluralistic futures_ A systematic literature review o.pdf,,0,societal transition: how to solve complex socio-technical issues,2,2,1,Marija Mateljan,10/21/25,Marija Mateljan,10/28/25
17:4,p 3,,"used in participatory speculative design to co-create pluralistic futures? To address these research questions, this paper will unfold as follows: first, we described the participatory shift in speculative design and expound on the formation of PSD. Secondly, through a literature review, we clarified the practical pathways of PSD across d",Co-creating pluralistic futures_ A systematic literature review o.pdf,,0,Research Questions,3,3,1,Marija Mateljan,10/28/25,ATLAS.ti,10/28/25
17:5,p 5,,The retrieval of literature data was sourced from two databases: Web of Science and Google Scholar,Co-creating pluralistic futures_ A systematic literature review o.pdf,Contribution: Summative/Integrative: Literature Review,1,"I guess Literature Review is also a contribution on its own, besides the practical steps.",5,5,1,Marija Mateljan,10/22/25,Marija Mateljan,10/22/25
