Publication Year,Author,Title,Url,Abstract,Keywords
2006,E. C. Jung; K. Sato,Context-Sensitive Visualization for User-Centered Information System and Product Design,https://dl.designresearchsociety.org/cgi/viewcontent.cgi?article=2610&context=drs-conference-papers,"Pervasive computing technology enables information systems to deliver their information services through diverse interactive products distributed across our activity space. For effectiveness and quality of information delivered to enhance user experiences, it is critical to shape information for delivery with appropriate contents, resolution, format, and timing according to user’s context changes. The concept of CSV (Context-Sensitive Visualization) has been proposed as a middleware for information systems and products development to deliver domain and system data to a user in context-sensitive way. Through the authors’ previous research, context has been defined as a set of user’s mental models activated by trigger elements in the given situation. The goal of this paper is to propose theoretical foundations to implement the concept of CSV by examining context models and exploring visualization schemes for the context models. Context models - how a user acquires and manipulates information in such a ubiquitous and pervasive environment - are surveyed and represented to provide criteria and scope for developing visualization schemes for CSV. Data encoded in knowledge-based information systems and products are visualized by integrating and dynamically mapping with two-layered visualization schemes: knowledge visualization and context model visualization. The main benefits of CSV are 1) improvement of information delivery and interaction quality by positioning information in user’s context model, and 2) the development of a common design framework to incorporate context-sensitivity into information system and product design for intelligent home, office, car, and mobile environments.","Human Centered Design of Products and Systems, Knowledge Representation, User-
Centered Design Research, Design Knowledge and Context-of-Use, Context-Sensitivity"
2006,HS Pacheco,Conventions of Typography Related to Traditional Poetry,https://dl.designresearchsociety.org/cgi/viewcontent.cgi?article=2531&context=drs-conference-papers,"This paper is part of a PhD research project which is in its final year. The aim of this research is to investigate and analyse how traditional poetry has been handled in books, in England, in terms of typographic development. The research examines the binary structure of the poem on the page, that is to say the opposing features of printed text and the space around it. In particular, it focuses on segmentation, which is the visible division of the text into units that, to a greater or lesser extent, reflects its underlying structure. This paper discusses conventions which have been established by typographers and manuals and attempts to further understanding about why such conventions were developed within poetry. It provides an overview of how the earliest printer’s manuals viewed poetry and how they offered suggestions as to printing rules. It then moves on to discuss how subsequent books on typography and manuals of style have treated the same issues. This paper shows that, although traditional poetry is a distinctive type of text characterised by regular meters and fixed poetic forms, books about typography and manuals of style have always treated this subject superficially.",N/A
2006,Artemis Yagou,Critical reflections on design and emotion,https://dl.designresearchsociety.org/cgi/viewcontent.cgi?article=2596&context=drs-conference-papers,"Design communities have recently witnessed a growing interest in the role of emotions. This interest has produced, among other things, a series of emotion-related events and publications which have brought to the foreground a considerable amount of relevant projects. This paper looks with a critical eye at this dynamically developing domain, questions its originality, discusses the conditions of its emergence and comments on its substance. As historical aspects of design suggest, emotion in design is as old an approach as industrial design itself. The renewed preoccupation with emotion has been favoured by the dominance of pleasure-oriented branding and marketing which has characterized consumer societies in the last part of the 20th century. This has resulted in a rather superficial treatment of human emotion, which leaves large areas of it outside the remit of design. I argue that, as we are gradually moving towards communities based on diversity, collaboration, and co-creativity, it would be worthwhile to reconsider the current emphasis on emotion in design. If “design and emotion” is to play a positive role for society in the near future, it should perhaps shift from the apotheosis of personal hedonism towards the exploration of socially relevant, culturally specific, as well as shared aspects of human emotions.","design and emotion, design history, critical thinking"
2006,Steven McCarthy,Defending the Domestic Environment from Advertising: the Commercial Rhetoric Art Project,https://dl.designresearchsociety.org/cgi/viewcontent.cgi?article=2591&context=drs-conference-papers,"Commercial Rhetoric Art Project examines advertising’s impact on the domestic environment through a body of creative work. By applying the methodologies of collage, montage and assemblage, commercial messages were subverted, juxtaposed and recontextualized into a critique of consumer culture. Issues of consumption, waste and sustainability are raised, and the role that graphic designers play in this system is questioned.","Advertising, design criticism, design authorship, consumer culture, collage, montage and assemblage, domestic environment."
2006,M. Brouwer; M.C. van der Voort,"Design for Dynamic Use Situations, First Steps in the Development of a Design Method that Supports Designing for Dynamic Use Situations",https://dl.designresearchsociety.org/cgi/viewcontent.cgi?article=2549&context=drs-conference-papers,"Products that are used in a dynamic situation are difficult to design with regard to usability. A dynamic use situation is a situation in which a product is used by various people, with different goals and/ or in different contexts of use. Since the use situation influences a product’s usability, a dynamic use situation can complicate the design process. We therefore propose to develop a new method to support the designer in dealing with dynamic use situations. The first step in this process is the definition of criteria for this design method. We distinguish criteria that concern analysis and evaluation of the design problem and criteria that concern the creation of solutions. Criteria for analysis and evaluation can be derived from a comparison with planning strategies through scenario planning. Applying these criteria to a first review of current user centred design methods leads to the conclusion that a promising basis for a design method for dynamic use situations can be found in scenario based design. This method should be integrated with creativity techniques and a technique which reveals the most important varying driving factors to build a frame of reference.","usability, user centred design research, design methods, dynamic use situations"
2006,JongHo Lee; Vesna Popovic; Kun-Pyo Lee,Design For Experiencing and User Involvement in the Product-Service Development Process,https://dl.designresearchsociety.org/cgi/viewcontent.cgi?article=2526&context=drs-conference-papers,"This study explores the integration of users into the design process. The research is related to participatory design and ‘designing for experiencing’. It challenges traditional designers to work closer with users. There are several projects done by adapting current participatory design tools and approaches into the new product-service development process. However, conflicts and misunderstanding about their contribution still exist. Thus, the aims of this research are (i) to investigate the functions of the participatory design tools by observing the interactive mechanisms between users and designers during the participatory or co-design process; and (ii) to study how and to what extent the user’s stories can be utilized to enhance the quality of innovative outcome in the participatory or co-design process. The research questions were explored with cultural probes imposed on industry-led participatory design workshop. Three pilot workshops were conducting in South Korea with the participation of two domestic users, one local designer and one facilitator. One case study was analysed. The initial findings showed the designer’s passive participation within the collaborative activities, but the users were very active. It seems that the designer’s inclination to the tangible aspects of the design might lead to the passive interaction during the workshop. These initial findings are directing future investigations toward the development of new participatory design tools which will be able to support active participation of both – users and designers.","interaction, user-designer collaboration, story"
2006,M Johansson,Design Games Reinstalling the Designer in Collaborative design,https://dl.designresearchsociety.org/cgi/viewcontent.cgi?article=2568&context=drs-conference-papers,,
2006,Lucy Kimbell,"Design leads us where exactly? Leading by design at Rich Mix, a new cultural venture in London",https://dl.designresearchsociety.org/cgi/viewcontent.cgi?article=2622&context=drs-conference-papers,"The aim of this paper is to contribute to knowledge about design by reflecting on an action research project where the author tested ideas explored in recent literature, including those concerning design leadership (the opportunity and necessity for designers to shape conversations about strategy; the ability of designers to frame unframed problems in challenging contexts); design thinking (the idea that design problems are indeterminate and that there are ‘designerly’ ways of knowing, thinking and acting); and that design-led approaches can help produce engaging information and communication technologies. These ideas were used to respond to an opportunity in which design played a key role in developing a place for public engagement with digital media in a new cultural venture called Rich Mix in London’s East End, where the author took a part-time role as lead designer. The working paper presents some of the initial findings from this research based on a case study of the project. These findings examine the limits of design leadership and design-led approaches in a complex, multi-disciplinary project in which the design problem was not initially framed.","Design leadership
Design management
Design thinking
Inter/multidisciplinary collaboration in design
Interaction design, and specifically new media, mixed media and interactive visualization"
2006,Yanki Lee,Design Participation Tactics: Redefining User Participation in Design,https://dl.designresearchsociety.org/cgi/viewcontent.cgi?article=2579&context=drs-conference-papers,"This paper started as a critical assessment of different practices of Design Participation, as first defined in the 1971 Design Participation Conference in Manchester (UK) organised by the Design Research Society (DRS). A rethought definition and typology of Design Participation was developed based on relations between the two ‘worlds’ of experts/designers and users/people. The realm of collaboration between the abstract space of designers and the concrete space of users is introduced. Different Design Participation practices were assessed for their appropriateness and effectiveness within past and current contexts, and in different stages and tasks within the design process. Community, Public and Design are three modes of participation, which are defined in order to understand the role of designers in the general field of participation. A detailed definition of Design Participation is made about four different types: innovation, necessities, collaboration and emancipation. Specific examples support the developing of new understanding framework of Design Participation with its complexity and its relationship with different social context. In conclusion, this paper urges the change of designers’ role as experts to design facilitators who develop design tactics with people.","user participation, user-designer experience, design process, participation, and social
responsibility"
2006,N Bitterman; N Naveh-Deutsch; E Lerner; I Shalev,Design Studies in Adapting Interactive Computer Interfaces for Elderly Users,https://dl.designresearchsociety.org/cgi/viewcontent.cgi?article=2550&context=drs-conference-papers,"Computer technology and the Internet have become inseparable parts of our daily lives. However, as people grow older and their physiological and cognitive functions deteriorate, many stages in the interaction with computers can be compromised. Taking into account the importance of interactive (web based) computer systems in our rapidly evolving “knowledge society “, and their inherent benefits for senior citizens and for the entire community, we initiated an ongoing research activity to study the compatibility of interactive computer displays, including health-care interfaces, for the elderly. The studies were performed on elderly (65+) and young participants. The participants completed various tasks on a variety of specially constructed, experimental prototypes of general and web-based health care systems, with hidden, computer implanted tracking programs. Experimental parameters included time for task completion, acuity, preference, satisfaction and physiological parameters of heart rate, skin temperature and sweat, measured with miniature sensors. Our results, based on three different studies (link configurations, nutrition intake and coagulation functions), suggest that older adults can perform Internet-related tasks as well as younger people, although more slowly. However proper links selection, user models and appropriate visualization methods can potentially improve the use of interactive computer systems by elderly users.","Design and the internet; Design for all; Design for healthcare; Design methods - design
research methods; Old."
2006,G C Raulik; P Larsen; G Cawood,Design Support and the Transfer of Knowledge to SMEs,https://dl.designresearchsociety.org/cgi/viewcontent.cgi?article=2558&context=drs-conference-papers,"Design support programmes have became more and more popular, with countries recognising the importance of helping their small companies to develop products and services with design input. This paper argues that the potential of such design programmes could be maximised if design organisations understood the importance of knowledge transfer in this context. It explains why the nature of design support schemes (usually public funded and focused on first-time users of design) make knowledge transfer an important asset for this activity. Analysis of information provided by clients of Design Wales, the design advisory service for Welsh industry (UK), is used as evidence for this argument. Knowledge transfer mechanisms are recommended for the best transfer of tacit knowledge and the role of the design advisor is emphasised as the agent of this transfer.","Design support or promotion, knowledge management, tacit knowledge, collaborative
influences on the design process"
2006,Stuart English,Design thinking - Value Innovation - Deductive Reason and the Designers Choice,https://dl.designresearchsociety.org/cgi/viewcontent.cgi?article=2580&context=drs-conference-papers,This paper is an introduction to a series of six papers concerning the modelling of design problem space. It explores the designer’s development of value through the use of deductive reason and subjective choice in the construction of design problem space. The author contrasts a hierarchic view of decision-making based on deductive reason with a parameter framing approach based on the cognitive modelling of problem space. Choice-inclusive and choiceexclusive decision making processes are considered with regard to their implication on responsible design practice. Potential for innovation is related directly to the problem framing process that provides the bounds in which the instability of the creative process can occur. Note: In this paper design is considered in a domain-independent form and designers are those involved in design thinking.,"Problem space, design innovation, value, decision theory and techniques, design reasoning"
2006,C Dilnot,"Design, Knowledge and Human Interests",https://dl.designresearchsociety.org/cgi/viewcontent.cgi?article=2572&context=drs-conference-papers,,
2006,M R Ranta,"DESIGN: Category Formation, Prototypicality and (Aesthetic) Preference",https://dl.designresearchsociety.org/cgi/viewcontent.cgi?article=2605&context=drs-conference-papers,"Cognitive psychology has, to a considerable extent, investigated the capacity of humans and other living creatures to categorize objects and events. The formation of categories enables us to apply previous experiences to new ones, to make inferences, to make predictions about the future, and they provide efficiency in communication - just to mention a few examples. Important questions, however, are how categories arise at all (i.e. whether, or to what extent, they are the result of environmental features or constructive processes on the part of the categorizer), and how they are represented in consciousness. Numerous cognitive psychologists have, following the psychologist Eleanor Rosch's initial work (1975; 1978; 1994), attempted to investigate the nature and acquirement of categories in general, most notably that of taxonomic categories. In this paper, I intend to give an outline as to how psychological categorization research might have implications for understanding some significant aspects of our preferences for instances of “design”. More specifically, I shall argue that matches and moderate mismatches between instances (and/or types) of design and beholders' mental representations and schemata may lead to hedonic effects and thus may have a bearing on their (aesthetic) preferences.","Aesthetics, cognitive psychology, psychology of art"
2006,Marlene Ivey; E. B.-N Sanders,Designing a Physical Environment for Co-experience and Assessing Participant Use,https://dl.designresearchsociety.org/cgi/viewcontent.cgi?article=2533&context=drs-conference-papers,"Since participatory design methodology began to take shape in the 1980s, the prevalent view of experience as something individual has expanded to include the experience of collective creativity – defined as co-design by Sanders (2002) and co-experience by Battarbee (2003). To date, research based on co-experience scenarios has focused on experiences that users create for themselves using products or services that already exist (Battarbee 2003) in spaces that do not appear to be specifically designed for co-experience. Kristensen (2004:7) refers to the limited address of the physical context of creativity. However, there is limited scope for developing knowledge in this field if we fail to attend to or question the design of the environments within which we exercise creativity. The aim of the research was to prototype a co-experience environment and to question how the design of a co-experience environment might contribute to new knowledge in design. The purpose of this paper is to communicate the methods used to create the co-experience environment, prompt co-experience and assess participant use of the coexperience environment. An exploratory exercise, the outcomes offer tentatative proposals that might influence our approach to designing for and engaging participants in future co-experience scenarios.","experience, co-design, participatory action research, design experiments. design as
scaffolding"
2006,Bianca Beuttel,Designing Culture In Between of Authenticity and Imagination,https://dl.designresearchsociety.org/cgi/viewcontent.cgi?article=2554&context=drs-conference-papers,"Based on the patterns “exotic”, “salvation” and “horror”, coined by the German media-theoretician W. Faulstich to describe the perception of foreign cultures in media, this research aims to discuss how the own culture and the foreign cultures are regarded. This includes the mechanism of exotification and selfexotification, the role of authenticity and imagination, and the perspectives provided by concept of “transculturality” which has been introduced by the German philosopher W. Welsch. Illustrated by Japanese examples of every-day-life consumer goods, their packaging and advertisement, it will be shown that these questions also seriously concern the field of product design - in its creation as well as in its perception.","Culture and design, Cultural hybridization, Emotions in subject-object relations"
2006,Jihoon Kim; Myung-suk Kim,Designing Engineering Education; Development of Design Education Model for Engineers,https://dl.designresearchsociety.org/cgi/viewcontent.cgi?article=2537&context=drs-conference-papers,"This research focuses on development of model used in teaching ‘Design Thinking’ to students majoring in engineering with emphasis on creative ideation and expression, and its application examples. Following the Second World War, educational circles in the area of engineering, due to excessive influence of Engineering Science, have come to concentrate relatively more on analysis of phenomenon and theoretical research rather than traditional format of engineering education, which places importance on visual thinking and actual experience, in development of curriculum. This research presents the process of development of new educational model in order to introduce core educational program of design that employs 4 types of activities, namely, ‘Problem Finding’, ‘Problem Solving’, ‘Visualization’ and ‘Evaluation’, as the main framework of educational curriculum for those who majoring the field to the existing engineering education circle; and introduces cases in which such has been actually applied to pedagogical area of the mechanical engineering in Korea. Furthermore, this research attempts to illustrate how Design Thinking can make contribution to other academic areas by transcending the academic boundaries of the existing studies in design.","design education, design pedagogy, product design, case study, multi disciplinary design"
2006,Low Chee Siong Edwin; Ching Chiuan YEN,Designing Product Character: Strategy to Evaluate Product Preference and Map Design Direction,https://dl.designresearchsociety.org/cgi/viewcontent.cgi?article=2540&context=drs-conference-papers,"According to Janlert and Stolterman (1997), “people, as well as things, have character- high level attributes that help us understand and relate to them.” de Bont et al. (1992) argues that users will prefer a product with characteristics that best match their needs or personality. As such, to influence user’s preference on a product, it is essential for the character of the product to be coherent with the user’s character. This is attempted by investigating products as “living objects”, eliciting specific characteristics or character attributes similar to the user. Though the concept of regarding products as animate objects is not new, the applications to design practices are rare. The aim of this paper is two-fold: firstly to propose an empirical model that attempts to evaluate user’s consumption preference; secondly by adopting the same model into current design practice, to map clear design directions. Expounded from areas of new human factors which provide a holistic view on the user’s characteristics (Jordan 2002), the empirical model is developed by exploring the subjective factors involved in the interaction process between the user and the product at the point of purchase. The etymology of Kansei and Chisei is employed as the basis of this interaction.","design character, empirical studies, material culture, user-designer experience, strategic design
planning"
2006,T Love; T Cooper; F Affleck; A Durey,Development of a Collaborative Design-focused Research Approach for Interagency Cooperation Addressing Youth Anti-Social Behaviour in Rail Environs,https://dl.designresearchsociety.org/cgi/viewcontent.cgi?article=2608&context=drs-conference-papers,"This paper reports the development, trialling and evaluation of a design-focused research method for collaborative design of interagency strategies and cooperative interactions to reduce anti-social behaviour by young people in rail environs. Youth anti-social behaviour in publicly accessible spaces such as train stations, parks, streets and retail environments has proven difficult to address via ‘simple’ single agency approaches. Most anti-social behaviour is not criminal. It can, however, have adverse impact on other potential users of the same spaces. To some constituencies with pecuniary interests, youth anti-social behaviour can have significant adverse financial impacts on their operations. In retail environments, for example, youth anti-social behaviour discourages shoppers from fully engaging in the planned shopping ‘experience’, with reductions in retail income; in public transport environments, it discourages travellers form using public transport. This results in a reduction on the public return on investment from public transport expansion programs, and an increase in cost associated with, e.g. pressure to provide increased resources for private transport infrastructure.","social system design, system thinking, practice-based research"
