Publication Year,Author,Title,Url,Abstract,Keywords
2006,T Fisher; J Mottram,Researching the Research Culture in Art & Design: The Art and Design Index to Theses,https://dl.designresearchsociety.org/cgi/viewcontent.cgi?article=2586&context=drs-conference-papers,"The aim of this study is to develop better function and performance for embodiment of electric-powered wheelchair from the aspect of human kansei. Embodiment is the concept which frequently used in robotics or neural science. An embodiment of electric wheelchair is to realize the function which is felt natural like flesh body. We studied it through the two standpoints. One is how it move, the other how we feel (kansei). Kansei is a concept that includes emotion and sensibility. Kansei was defined as an intuitive ability to react and evaluate the values like pleasure and comfort. As we were factoring out elements in motions that seemed to have been concerned with embodiment, we came to the guess that such subtle motions that existing electric wheelchairs never have had, might help people with lower limb disability regain harmony with their body. We have focused on the following motions with the office setting in mind: • Unconscious gesture (UG) that is made when people try to release or avoid stress. • Subtle motions to change position We have hypothesized the objectives of these motions, designed and built an experimental device to mechanically reproduce these motions for an evaluation experiment.",kansei engineering
2006,M. Eaton,Revisiting Philosophy and Education in Landscape Architecture,https://dl.designresearchsociety.org/cgi/viewcontent.cgi?article=2523&context=drs-conference-papers,"There is a crisis in landscape architecture. Where, as a design discipline, the profession is meant to act as a mediator between culture and nature, an absence of continuous critical enquiry, both at a professional level and at an academic level, weakens it. Almost a decade has passed since I examined the role of philosophy and design in landscape architecture education, and from what I have witnessed as an educator, there is still a deficiency of rigour of inquiry. As such, one must ask: where is the leadership in landscape architecture, and are we remaining true to ourselves as designers, if we have become complacent with that which exists? The aim of the paper is to reflect upon conclusions drawn in initial research on the topic, and to provide a forum from which that state of landscape architecture, and its relation to philosophy and design may grow.","Education, philosophy, aesthetics, ethics"
2006,Denise Dantas,Senac Symposium on Materials: an experience to give guidelines for a “Cartography of Materials”,https://dl.designresearchsociety.org/cgi/viewcontent.cgi?article=2525&context=drs-conference-papers,"This article presents the experience of realizing a discussion forum on Design and its relation with materials as a methodological strategy to structure a “Cartography of Materials”. The event had a different configuration from the way it is normally set up in Brazil, for it promoted an articulation among academic researchers, companies that produce materials and products as well as designers working in the market. The aim was to increase the potentialities of working in the three areas involved: teaching/learning, autonomous professional working and serial industrial production. The proposal’s thematic core consisted of a reflection on the possibilities of the material as a conditioning requisite of the contemporary projectual practice, a theme seldom approached as the main subject at Brazilian events in the field of Design. Thus the “Senac Symposium on Materials”, a forum with a national scope, produced an interdisciplinary reflection on the multiple possibilities of materials use in Design projects, most of all on the structuring/configuring conditions for projectual thought and for the techno-productive relations present in objects in our contemporary society.","case study, collaborative design research, design and material, design and sustainability, identity and design"
2006,Ana Mestre; J.C. Diehl,"Significances of Matter in Design (SMD) A Portuguese Design Research Project about Sustainability, Identity and Innovation.",https://dl.designresearchsociety.org/cgi/viewcontent.cgi?article=2578&context=drs-conference-papers,"At a global level, we can observe an increasing relation between Design and the new paradigm of Sustainable Development. This combination of Design and the three pillars of Sustainable Development (Social, Environment and Economics) have laid the new conceptual base for Design for Sustainability. On an international level, Research and Development in the field of material and production technologies has led to the development of promising new sustainable materials. These materials distinguish themselves from ordinary materials by for example consuming less raw materials and energy during production, by being lightweight or by being avoiding damage during the disposal stage of the products. At a regional level the availability of traditional sustainable materials and technologies (which are until now mainly connected to arts and crafts and applied by artisans), part of the Portuguese material cultural identity, could have an important role in the development of new sustainable design solutions and new contemporary expressions of Portuguese design, based upon the reinterpretation of Cultural Significances of Matter. Both the global and local context of materials knowledge were essential elements of the project “SMD: Significances of Matter in Design”, developed by: SUSDESIGN1 with the financial support of IA2 from the Portuguese Cultural Ministry, as well other relevant institutional partners: FBAUL3, DUT4 and IADE5. The main goal of the project was the development of research and application activities in the field of materials and design, including the relation between the new global trends in Design for Sustainability and Local Cultural Heritage (artifacts and materials). This was done by a wide range of activities, amongst others, by interacting with design students at design schools, by exploring materials characteristics and applications from traditional and new innovative materials. In addition Portuguese designers from different generations have been challenged to develop design solutions in collaboration with local artisans. The final outcome was an international exhibition demonstrating the results of the research, student works and the design solutions developed by teams of Portuguese designers & artisans. In this paper, the authors will present, first, the context of the project “Significances of Matter in Design”, the research methodology applied and finally the main activities and outcomes of the projects – the Design Projects - as well the main conclusions.","Design for Sustainability, Design with Cultural aspects, New Crafts and Design."
2006,S Backlund; M Gyllenswärd; A Gustafsson; S Ilstedt Hjelm; R Mazé; J Redström,STATIC! The Aesthetics of Energy in Everyday Things,https://dl.designresearchsociety.org/cgi/viewcontent.cgi?article=2555&context=drs-conference-papers,"Static! is a project investigating interaction and product design as a way of increasing our awareness of how energy is used in everyday life. Revisiting the design of everyday things with focus on issues related to energy use, we have developed a palette of design examples in the form of prototypes, conceptual design proposals and use scenarios, to be used as a basis for communication and discussion with users and designers. With respect to design research and practice, the aim has been to develop a more profound understanding of energy as material in design, including its expressive and aesthetic potential, thus locating issues related to energy use at the centre of the design process.","interaction design, design for sustainability, critical design, practice-based research"
2006,A.V. Valtonen,Strategies for Surviving in a Changing Environment The History of Industrial Design Education in Finland,https://dl.designresearchsociety.org/cgi/viewcontent.cgi?article=2527&context=drs-conference-papers,"This paper proposes a design framework, which examines the communication process between a female user and the Graphical User Interface (GUI) of a medical device to enhance her health matters; in particular, understanding their underlying needs and responses toward to the use of the device. The emphasis of the paper is to investigate the role of designer and health message within the communication process, in addition to identify appropriate GUI attributes relevant for the design of medical devices; aspects of response from the female user and other probable users are gathered. To broaden the framework, the role of existing visual references is examined, and the effects of moderating influences are discussed. Remaining cognizant of these different elements of response, and conceptualizing them as part of the framework presented, will assist further attempts to understand female user response to the Human-Computer Interaction (HCI) domain; transferring key ideas to further product design and development for female-centered medical devices. In conclusion, implications for future design practice, usability engineers of medical devices, and design research are presented.Education, and industrial design education in particular, is affected by changes in the economy, industry and society. This paper will show how the strategic choices made in education and the affinity of the curriculum to the dominant markets contributes to its ability to adjust to these changes and to benefit from them. The Finnish case will be used to illustrate this, and the empiric findings thereof will be studied through existing literature on professionalisation. Industrial design education in Finland had to gain status and differentiate from a strong tradition of arts, which led to the emphasis of a scientific cognitive basis. Then, striving for a cognitive basis resulted in new areas of design theories, such as ergonomics and design management, which changed the role of the designer and the education. This in turn made them better aligned with the industry and economy. As Finland experienced a structural change from forest industry to new high technology industries, which needed increasing amounts of industrial design professionals, the number of institutions offering design education exploded. This paper will show how industrial design education was able to adjust to these changes successfully.","visual communications; medical technology and innovation, e-health; usability of informationindustrial design, design education and research, technological and social change, professionalism, educational strategies"
2006,J. Restrepo,Studying Design Engineers use of Information Systems: Which variables to control for?,https://dl.designresearchsociety.org/cgi/viewcontent.cgi?article=2607&context=drs-conference-papers,"Studying information usage by design engineers involves considering technical, social, cognitive and volitional factors. This makes it challenging, especially for researchers without a cognitive psychology background. This paper presents a summary of key findings in researching information use and processing in design, discusses important issues on the selection of a research strategy and sums up the important variables that need to be controlled for.","analysis of design processes; cognition, creativity and computers in design; information
processing and knowledge management in design;research methods and tools for design;"
2006,S Lundgren; O Torgersson; L Hallnäs; P Ljungstrand; E Eriksson,"Teaching Interaction Design: Matters, Materials and Means",https://dl.designresearchsociety.org/cgi/viewcontent.cgi?article=2575&context=drs-conference-papers,"The designer works with people, with materials, with products. Designers are seen as people concerned with form, function and surface. But how often is the designer associated with technology? Still programming can be just as a creative activity as drawing. Deriving from experiences from the discipline of Interaction Design, we advocate a wider view on what a designer is and does by describing how we treat computational technology as any other design material and how we train engineering students and others into becoming designers in a technology-oriented environment. Our method to create an education in applied Interaction Design lends ideas from traditional design education, for instance open problems and exhibitions of results, but also incorporates high-fidelity prototyping and multidisciplinary projects carried out by heterogeneous groups, since this lies in the nature of the subject and the students.","interaction design education; design and development; collaborative influences on
the design process; design pedagogy;"
2006,D. M. Büchler; M. A. R Biggs,The designed object that we know and see,https://dl.designresearchsociety.org/cgi/viewcontent.cgi?article=2598&context=drs-conference-papers,"This paper discusses perception of the designed object and how our knowledge impacts on our visual perception of that designed object. It expands on the notion of interpretation both in the context of material culture and in the context of psychology. It explains how the approach to interpretation in both disciplines relies on an active observer/perceiver. The issue of perception of the designed object is approached using the theories of the perceptual psychologist Richard L. Gregory. His work is shown to be especially relevant because there is a degree of commonality between his view of interpretation and that of material culture. The overlap of the two approaches is sufficient to invite a greater exchange between the two disciplines. The conclusion of the paper is that a visual perception transformation occurs when knowledge filters our perception of the designed object. The paper maintains that this transformation of our visual perception of the designed object is a case of perceptual illusion, as coined by Gregory, and that it occurs when knowledge overrides visual perception.","Psychological theory building in the design field
Visual perception
Consumer perceptions
Design and branding
Cognition/perception"
2006,L Feast,The Discrete and the Continuous in Architecture and Design,https://dl.designresearchsociety.org/cgi/viewcontent.cgi?article=2530&context=drs-conference-papers,"architecture and design. In architecture this has been and characterised by the displacement of deconstructivist techniques of collage and contradiction with a folded logic of continuity and curvature. A correlative development can be discerned in design within the transition from the external moral code of green design to the immanent ethics of sustainable design. This parallel development suggests a rich site for dialogue and exchange between folding in architecture and the ecology of sustainable design, one that I argue presents an immanent field of design without transcendent unification of the disciplines. This paper seeks to examine this conceptual site through the interactive reflection of the philosophy of Gilles Deleuze (1925-1995) with design research, which I will argue has the potential to develop and extend current thinking in design ethics and aesthetics.","Design Ethics, Design Aesthetics, Fold, Architecture, Eco Design"
2006,A Woodcock; J Burns; E Gaura; R.M. Newman; S Mount,The evolution of the Mars Daisy,https://dl.designresearchsociety.org/cgi/viewcontent.cgi?article=2589&context=drs-conference-papers,"The paper traces the evolution of the Mars Daisy animation; a visualisation developed to initiate collaboration between two groups within the university, enhance communication and understanding within the Cogent Computing Group, publicise an expanding, difficult area of research and enrich the learning experiences of students.","animation, design reseacrh, visualisation, information dissemination"
2006,Edward Hollis,The Fairy Stories project: Towards a history of Architecture as a time based medium,https://dl.designresearchsociety.org/cgi/viewcontent.cgi?article=2547&context=drs-conference-papers,"The History and Theory of Architecture have traditionally discussed buildings as if they were the fixed, timeless emanations of the mind of an omnipotent Architect. However, the real life of buildings as we experience them is anything but fixed, pure, or timeless. In order to survive, buildings have to be as chimerical and cunning as the people who made them. This paper proposes an alternative history of Architecture that aims to resolve this contradiction between Theory and Practice. This proposed History records the survival stories of a number of buildings, told in the manner of stories that have themselves survived through repeated shape shifting –myths and fairy stories. By telling these stories, this proposed history of Architecture aims to feed the practice of Architecture with examples that illustrate how flexible, ephemeral, and engaging the life of buildings can be.","narrative and design, history and theory of architecture, rites and rituals in everyday life, concept of research, timeless-ness"
2006,S Yelavich,The Fluid Contemporary Interior,https://dl.designresearchsociety.org/cgi/viewcontent.cgi?article=2618&context=drs-conference-papers,"This paper explores the elision of public and private realms in the interior at advent of the 21st century. “The Fluid Contemporary Interior,” covering the mid-1980s to the present, surveys the interior spaces of the house, the apartment, the loft, the office, civic spaces, religious spaces, cultural spaces, retail spaces, restaurants, hotels, and therapeutic spaces. A critical assessment of the social implications of the contemporary interior, this paper examines the fluctuations in design typologies in a globalized era. For example, hospitals are increasingly adopting the form language of spas and health clubs to allay patient's fears and to be more responsive to their psychological needs; at the same time, spas and health clubs adopting the language of clinics to suggest that their services are a vital dimension of physical and mental well being. Civic spaces, from embassies to libraries to schools, are now designed to promote interaction and to erase the memory of anonymous institutional interiors. Offices are using furnishings and spatial strategies formerly in the domain of the home; likewise, retail spaces provide amenities to blur the commercial nature of their activities. My paper not only valorizes these shifts but also questions their implications in the nascent 21st century.","architectural design, interior design, design studies, contemporary design."
2006,Theresa Beco de Lobo,The Poster of the New State,https://dl.designresearchsociety.org/cgi/viewcontent.cgi?article=2624&context=drs-conference-papers,,
2006,W. H. CHOU,The Reorganization of Graphic Design History,https://dl.designresearchsociety.org/cgi/viewcontent.cgi?article=2590&context=drs-conference-papers,"To resolve the marginalisation of East Asian design in graphic design history, this research argues for design history’s reconception from the perspective of deeper historical and globological structures than the recent prominence of Euro-American design. That Western society has integrated its current global power with processes of cultural imperialism is evident from the writing of graphic design history. The metadiscourses of Euro-American modernism and postmodernism constitute the roots of privileged and prejudicial knowledge in the history of graphic design, establishing Western developments as the yardstick for the production and ordering of graphic design history. Substantive frameworks for shaping design history are necessary. However, frameworks are also necessarily subject to change as historical conditions alter. The rise of East Asian economies raises the issues of the cultures that support them, including their cultural heritages, which have had a world historical influence over fields like writing, printing and design. Writing the history of East Asian design cultures not only acknowledges their historical importance, it is fundamental to their future development as distinctive design spheres while opening up the scope for culture-based knowledge and understanding to reorient homogenous Western design.","Taiwanese Graphic Design History, Graphic Design History, Globological Perspective, Euro-American Design, Cultural Marginalization"
2006,K. Niedderer; M. A. R. Biggs; M. Ferris,"The Research Exhibition: context, interpretation, and knowledge creation",https://dl.designresearchsociety.org/cgi/viewcontent.cgi?article=2560&context=drs-conference-papers,"In this paper, we investigate the problem of the nature, role and purpose of the research exhibition. The problem arises from the desire of practitioner-researchers to use the exhibition as a research tool. However, at present it is not clear whether, and in which way, the research exhibition is different from an ordinary exhibition, nor what its particular contribution to research might be. We investigate the problem of the research exhibition in relation to the conventional art/design exhibition as a familiar medium of communication in art & design. We compare the aims of research and practice, and we analyse how the aims of practice are served and communicated by the exhibition. We then conjecture how the research exhibition might serve to advance and communicate research, and on its potential form and purpose, by differentiating it from the art/design exhibition and its purpose. The outcome of the research is a set of criteria with which to identify and differentiate the research exhibition from a conventional exhibition. We conclude that the research exhibition can be used both as a research tool and as a means of communication of research.","Research exhibition, research methods, knowledge, communication, artefacts."
2006,Yi-Cheng Chiang,The Role of Design Eureka in Design Thinking,https://dl.designresearchsociety.org/cgi/viewcontent.cgi?article=2611&context=drs-conference-papers,"Most of design researches have paid attention to the rational aspect of design, such as systematic process, design reasoning, design knowledge and so on. However, flashes of insight really occur in many designs. By protocol analysis, the present paper studies such a particular thinking phenomenon of design—the so-called ‘design eureka’. Design eureka always occurs suddenly and is so slippery to catch and to explain. Before design eureka can be understood by analysis, it is the first task to capture it successfully. This paper aims to develop an effective method of describing design eureka in order to have further analysis possible. Four real-world protocols, all experienced design eureka in their design process, are deeply investigated by a series of analyses. In the tables and network-figures of the analytic method, the actual evolutions of design thinking are visualized and show out the place of “design eureka” in the context with design “bottleneck”. Secondly, through the advanced content analysis, the evolution of bottleneck problems and the “exterritoriality” of design eureka are revealed and explained. Three critical characteristics of design eureka are discussed. The results indicate a kind of particular faith in designer’s intention, which plays a central role of design-art creativity and makes design to go beyond problemsolving scope but near a kind of art-working.","analysis of design thinking, architectural design, critical thinking, creative processes and design, design cognition"
