Publication Year,Author,Title,Url,Abstract,Keywords
2018,Martin Tironi; Matías Valderrama,Regimes of Digital Quantification: making data-driven decisions?,https://dl.designresearchsociety.org/cgi/viewcontent.cgi?article=1546&context=drs-conference-papers,"In light of the proliferation of sensors, data and analytics, multiple digital quantification regimes are emerging under promises of a revolutionary change in the way in which decisions are made in areas such as urban planning and government. These regimes present a growing need to differentiate themselves in order to capitalize their data, deploying particular technologies that go beyond the digital. In this paper, we review two digital quantification regimes of urban cycling in Santiago, Chile: the RUBI device and KAPPO smartphone application. Through the study of the design of material and narrative technologies of these regimes, we will show how they try to distinguish their modes of quantifying the cyclists’ mobility, configuring particular versions of target users, the city and its forms of government, in order to promote an urban planning driven by data.","digital quantification regimes, data-driven decisions, self-tracking, smart urbanism"
2018,Nolwenn Maudet,Reinventing Graphic Design Software by Bridging the Gap Between Graphical User Interfaces and Programming,https://dl.designresearchsociety.org/cgi/viewcontent.cgi?article=1597&context=drs-conference-papers,"Graphic Design Software Applications radically transformed the practice and the industry of graphic design. However, they barely evolved since their introduction, leading designers to question their ubiquity. In this paper, we explore this mismatch by analysing digital design tools through two lenses. We first investigate digital design tools from a “lineage” perspective: how they reproduced the pre-existing design tools and practices. We then use two familiar examples: the colour picker and the alignment and distribution commands to explore the vision of design that they promote. We reveal how these tools assume that designers already have in mind a desired outcome and thus introduce a mismatch with current designers' practices. To bridge this gap, we propose “graphical substrates”, interactive and visual tools that combine the strengths of both programming and graphical user interfaces. We analyse how several recent research design tools embed this approach and we propose two principles: tweaking and creation from example to foster their adoption by designers.",design tools; graphic design; graphical user interfaces
2018,Donato Ricci; Agata Brilli; Roberta Tassi,Repurposing Digital Methods for Human-Centered Design,https://dl.designresearchsociety.org/cgi/viewcontent.cgi?article=1632&context=drs-conference-papers,"From logs and information left in online spaces to data points self-generated by connected devices, digital traces have become more diffused over the past years, prompting an expansion of Human-Centered Design methods. Along with some big- data approaches, Digital Methods of research – treating the actual content of digital users’ manifestation on-line (i.e. tweets, Instagram pictures, comments) – offer the opportunity to better understand users through their online activities. This paper investigates how Digital Methods can be repurposed as a full-fledged approach for Human-Centered Design. Grafting on the NATURPRADI project – a research aimed at describing the debate raised by the re-vegetation of the city of Paris by analysing Twitter posts – in the paper we will explain how we have identified and described a set of personas characterized by different approaches towards the evolution of the urban nature issue. The final objective of the paper is to provide a first methodological tool created at the intersection of Digital Methods and Human-Centered Design discussing its opportunities and criticalities: Data-driven Personas.",personas; human-centered design; digital methods; mixed methods
2018,Paulo Roberto Nicoletti Dziobczenski; Oscar Person; Leandro Miletto Tonetto; Roberta Rech Mandelli,Requests from Companies and Requirements for Design Education in Brazil: where do they meet?,https://dl.designresearchsociety.org/cgi/viewcontent.cgi?article=1705&context=drs-conference-papers,"In this paper, we study what companies request from applicants for graphic design positions in Brazil. Based on a document analysis of 371 job advertisements, we uncover 35 different types of requests which we structure in terms of (1) Design deliverables, (2) Knowledge and skills and (3) Personal traits. In addition, we explore how the content of job advertisements potentially can inform educational developments by reporting on a group interview with design educators. In the interview we explore the degree to which different requests in the advertisements are covered in a regulatory educational design policy document for higher education in Brazil. Our results show that requests for skills in 2D software, an ability to deliver print and digital design outcomes and knowledge of layout and photography are frequently occurring in the studied advertisements. We also describe how the educators could locate the majority of the requests in reviewing the educational policy document. We end the paper by discussing how job advertisements could be further studied and used by design educators and practitioners.","design education; design competencies; document analysis, Brazil"
2018,C. Grey Isley; Traci Rider,"Research-Through-Design: Exploring a design-based research paradigm through its ontology, epistemology, and methodolog",https://dl.designresearchsociety.org/cgi/viewcontent.cgi?article=1533&context=drs-conference-papers,"Design research has risen in prominence over the past 20 years resulting in substantial discussion regarding it’s ontological and epistemological foundation, but there has been limited progression towards consolidation of the disparate views into a fundamental design paradigm. Design researchers continue to struggle to find a unified paradigmatic voice and move beyond a pre-paradigm state. Relying on the foundational support created by Sir Christopher Frayling’s taxonomy of design-based research, many have proposed the creation of a new research paradigm. This requires critical discussion on how design differs from the existing realms of research, as well as establishing the ontology, epistemology, and methodology appropriate for this new paradigm. Through literature and an established philosophical framework, this paper will look at the foundational arguments that have been generated by scholars within the design disciplines for this new paradigm, synthesizing a proposal for the associated ontology, epistemology, and methodology.",research through design; design research; design paradigm; epistemology
2018,René Sørensen Overby; Camilla Ryhl,Responding to Diversity Including Disability,https://dl.designresearchsociety.org/cgi/viewcontent.cgi?article=1665&context=drs-conference-papers,"This paper constructs a framework for understanding how notions of disability influence the discourse on accessibility and Universal Design as well as the present understanding of the user role in Denmark. Implications are that the understanding of disability and design of architecture are not mutually opposed to one another. Instead they are closely interwoven in the fabric of designing for diversity. Through the perspectives of the UN Convention on the Rights of Persons with Disabilities, Disabled People's Organisations Denmark and the practicing Architects, the paper discusses three notions of disability. Initial findings of the PhD research project “Generating Inclusive Built Environments through User Driven Dialogue in the Architectural Design Process” along with qualitative research conducted at the Danish Building Research Institute frame former and current thinking, and discusses the scope of reviewing impairment as a condition of human variety in the architectural design process.","universal design, architecture, values, design process"
2018,Jane Scott,Responsive Knit: the evolution of a programmable material system,https://dl.designresearchsociety.org/cgi/viewcontent.cgi?article=1633&context=drs-conference-papers,"Programmable knitting presents a new class of behaving textiles, responsive to environmental stimuli and programmed to change in shape as humidity levels in the environment increase. It is a hierarchical system that exploits the inherent functionality of textile fibres, yarns and fabrics to integrate shape change behaviour into the intrinsic structure of the material. The research applies a biomimicry methodology, with insight derived from the structural organisation of plant materials; specifically, the control of hygromorphic actuation for seed dispersal. This biological model has produced transferable principles for application to responsive textiles and it has been critical to the success of the research. But how can this research advance thinking on the design potential of programmable materials? This paper explores how the complex hierarchies that exist within textiles can be used to engineer a unique class of programmable systems. This challenges conventional smart interfaces that rely on mediated responses via electronic control. Instead this paper demonstrates how an alternative approach informed by biomimicry can generate a new class of smart-natural materials.","programmable materials, knitting, biomimicry, the responsive environment"
2018,Sanda Lenzholzer; Steffen NIJHUIS; João Cortesão,RTD in Landscape Architecture: a first State of the Art,https://dl.designresearchsociety.org/cgi/viewcontent.cgi?article=1535&context=drs-conference-papers,"The discussion regarding the relation of design and research in landscape architecture started somewhat later than in other design disciplines. But the past decade has shown a sharp rise of publications on ‘research through/by design(ing)’ (RTD). The literature has now reached a level of richness that enables a review of the State of the Art and a differentiation of types of contributions to the discourse. We reviewed more than 200 publications (scientific journal papers, conference papers, PhD theses, MSc theses and others) on RTD in relation to landscape architecture and closely related disciplines. The review shows that a rather small portion of the publications deals with RTD a scholarly sense. The remaining portion of scholarly publications offered a useful base for further scrutiny. We categorised the relevant literature according to types of publications and the epistemological stances taken. Based on this categorisation we identified areas that need further research and thus sketched an agenda for further research on RTD in landscape architecture.",landscape architecture; research through design; research by design; review
2018,Anne Burdick,Scenes of Writing,https://dl.designresearchsociety.org/cgi/viewcontent.cgi?article=1525&context=drs-conference-papers,"This paper looks at how speculative fiction can provide a design space to explore the effects of technologies for critical interpretation. Using Trina: A Design Fiction as a case study, the paper builds upon Lucy Suchman’s study into how technology teams design “the human” in tandem with the computer, asking can there be a model of “the human” suited to technologies for subjective judgment? Looking closely at the characters in Trina, we see individuals whose capacities, specificities, social histories, and individual biographies inform the degree of agency that each has with the writing technologies that define their work and worth. Accounts of writers and their inscription technologies found in recent literature from media and literary studies further demonstrate the contingent nature of textual composition. Rather than look for a generalized human-computer fit, the paper argues for the design of story-worlds in which specific humans, non-humans, and networks are designed in one and the same gesture, revealing the productive misalignments and contested boundaries that define their interactions.",design fiction; human-computer interaction; writing technologies; digital humanities
2018,Sedef Süner; Çiğdem Erbuğ,Seeking for Diversity among Young Users: the case of children's photography,https://dl.designresearchsociety.org/cgi/viewcontent.cgi?article=1666&context=drs-conference-papers,"User-centred design practices in the design of products for children’s use has become common, especially in the field of technology design. Although young users are now considered as essential and reliable actors to inform the design space, design research with children still remains focused on the design process itself, and children’s role in it. In an attempt to steer away the discussion from how children are included in design to how they are represented in design, our paper focuses on understanding and communicating plurality of the experience among young users to inform and expand the early design phase. For this purpose, we present an overview of the child-centred design practices, discuss how designers of children’s products may benefit from an experiential approach for a holistic understanding of the user space; and finally, we present our study on children’s photography to illustrate how a commitment to understanding children’s perspectives can contribute to eliciting, and representing user diversity through personas to guide the design of meaningful products for young users.","child-centred design, children’s photography, user experience, persona"
2018,Sarah-Marie Foley; Dan Lockton,Service Fictions Through Actant Switching,https://dl.designresearchsociety.org/cgi/viewcontent.cgi?article=1528&context=drs-conference-papers,"Actor-Network Theory (ANT) and speculative design inspired the creation of Actant Switching and Service Fictions. ANT states that each action is a system made up of human and nonhuman actors. All actors play their set role for the system to move forward. By mapping out the system, ANT can enable exploration of relationships within a context. Actant Switching is a method for speculative scenario creation that interchanges human and nonhuman actors to create counterfactual scenarios exposing tension with the context and technology. Service Fictions is a method for engaging participants in a co-created speculative design around the created Actant Switching scenarios. A case study on sleep practices demonstrates these techniques. Both methods enable insights from allowing participants to confront their relationship with a system, to make explicit the implicit roles in the system and therefore their relationship with technology. These methods are a useful addition to designers’ toolboxes, at the intersections of service design, speculative design, and participatory design. Both techniques provide a practical way to apply ANT.",speculative design; participatory design; actant switching; service fictions
2018,Ann Bosserez; Griet Verbeeck; Jasmien Herssens,Shifting Towards a User-Centred Approach for Resource-Efficient Building: lessons from an educational study,https://dl.designresearchsociety.org/cgi/viewcontent.cgi?article=1646&context=drs-conference-papers,"When implementing energy-efficient housing concepts in practice, designers often apply an object-centred design approach that generates a static built environment, causing higher material consumption, building costs and actual energy demands when the building is in use. To provide an alternative solution for current energy-efficient renovation concepts, previous research suggests a user-centred approach which considers dynamic residents and varying conditions throughout the seasons. The approach aims to promote more efficient occupant behaviour to decrease the actual energy demand by enabling a dynamic way of living throughout the seasons. The research hypothesis is that decreasing the actual energy demand of the resident by means of a user-centred design approach can limit the need for additional quantities of materials and renovation costs (resource-efficiency). In this context, the shift from an object-centred approach for energy-efficiency to a user-centred approach for resource-efficiency is tested by means of an educational study within the design studio ‘Zero Pentathlon: sustainable housing renovation’ at Hasselt University, Belgium. The paper presents a critical reflection on the students’ analyses of dynamic residents, the resulting dynamic design concepts, and the effect of the user-centred approach on the energy-efficiency of the building. The paper finds that the resulting designs which best enable a dynamic way of living throughout the seasons come from students who analysed the dynamic properties of residents more in-depth. These designs promote efficient occupant behaviour and show potential to contribute to the energy-efficiency of the building. However, it is also concluded that it was challenging for all students to create a synergy and incorporate both the analysis of residents and analysis of the built environment within a resource-efficient building design. The findings will serve as input for future research to further develop an alternative user- centred design methodology for resource-efficient building.",energy efficiency; educational study; user-centred design approach; resource-efficient renovations
2018,Priscilla Ferronato; Stan Ruecker,Smart Citizenship: designing the interaction between citizens and smart cities,https://dl.designresearchsociety.org/cgi/viewcontent.cgi?article=1648&context=drs-conference-papers,"Based on the study of recent research regarding the development of smart cities, this paper develops a critical reflection about the reasons why not every citizen in a smart city can be considered a smart citizen. We point out some of the primary causes and the role of design to help to develop possible solutions. The paper uses the concept of the network society and actor network theory in order to understand the infrastructure of smart cities and develop an analysis of the changing role of citizens into smart citizens. We propose that there is a need for new methods to generate sustainable and inclusive social engagement to solve collective urban problems. Moreover, it is speculated that smart citizenship will be an important part of the future of smart cities. In this context, design plays an important part, framing the way actors understand and interact with each other in the city ecosystem, and enabling citizens to shape the future of their cities.",smart cities; smart citizenship; open design; metadesign
2018,Cyril Tjahja; Joyce Yee,Social Hierarchy in Design and Social Innovation: perspectives from Thailand,https://dl.designresearchsociety.org/cgi/viewcontent.cgi?article=1574&context=drs-conference-papers,"Our knowledge of how design and social innovation works outside of the Europe and the US is still insufficient, due to the limitations that are inherent to the prevailing perceptions, methods and tools, developed in and for this context. Although the importance of social relationships has been acknowledged, how social hierarchy, which is firmly rooted in many non-western societies, interacts with the design and social innovation process is scarcely documented. In this paper, we wish to expand on existing knowledge by sharing the experiences of practitioners and stakeholders involved in design and social innovation initiatives in Bangkok, highlighting the various ways that social hierarchy influences their practice.","design and social innovation, Thailand, social hierarchy"
2018,Marie-Julie Catoir-Brisson,Social Innovation by Design in Mobile Healthcare for Sleep Disorders,https://dl.designresearchsociety.org/cgi/viewcontent.cgi?article=1669&context=drs-conference-papers,"This project-grounded research aims at answering a need for research on sleep disorders and connected objects, through an interdisciplinary dialogue between human and social sciences, medical sciences and design. The objective of this article is to answer the following questions: how can social innovation by design sustain the development of innovative medical devices? How can design work to optimize the prevention, the support and the follow-up in sleep medicine? The project aims at creating a digital platform optimizing the circulation of the data, the customer’s journey and the communication between patients and care professionals. The research has had a double scientific challenge, carrying on therapeutic education in sleep and digital health literacy, especially in the field of medical computing and mobile devices for chronic diseases. First, the scientific roots and methodology is explained. Then, the methods of inquiry and the results are reported. Finally, a contribution to design research for healthcare is proposed, focusing on the role of design in promoting sleep’s hygiene through the creation of suitable services, products, experiences and healthcare environments.",m-Health; insomnia; service design; digital literacy
2018,Young-ae Hahn,Socio-Cultural Factors in Diabetes Care in South Korea,https://dl.designresearchsociety.org/cgi/viewcontent.cgi?article=1675&context=drs-conference-papers,"In this study, the author reports findings and design outcomes from a 16-week healthcare design course led by two instructors in collaboration with medical experts at a tertiary medical institution. The research team investigated South Korean socio- cultural factors that adversely affect people’s health and trigger diabetes onset: excessive working hours and drinking culture, social stigma and patients’ hiding behaviours, and reliance on unverified information from online communities. The same factors also pose serious difficulties in diabetes patients’ diet and exercise management. To address the problems, students proposed four design concepts: (1) a portable, integrated blood glucose meter and insulin pen, (2) a mobile application for verified diabetes information from licensed medical personnel, (3) a smart lunch system for safe out-of-home meals, and (4) an improved design of health check-up report format for patients with low health literacy.","South Korean culture, diabetes care, socio-cultural factors"
2018,Heekyoung Jung; Anna Ståhl,Soma-Wearable Design: Integrating Somaesthetic Practice and Fashion Design for Somatic Wellbeing,https://dl.designresearchsociety.org/cgi/viewcontent.cgi?article=1678&context=drs-conference-papers,"With advanced technologies and raised expectations for the quality of life, research and design attempts are increasing to promote wellbeing. While data-based reflective practice and behaviour change have been a main strategy in supporting technology- mediated wellbeing, we bring the perspectives of somaesthetic practice and fashion design to complement this research scene. Assuming that body consciousness could positively influence self-perception, presentation and performance through clothing, we propose soma-wearable design as an alternative approach to explore qualities that elaborate and promote somatic wellbeing. First, we conceptualize constructive links between design for reflection, somaesthetic practice, and style-fashion-dress; and re- interpret the core qualities of somaesthetic appreciation (Höök et al., 2016) for soma- wearable design: 1) transient space for reflection with the body, 2) sensory prompt synched to context, 3) body modification for subject formation, and 4) learning through bodily experience. We articulate these qualities based on the survey of selected fashion objects; apply the soma-wearable design approach to a workshop with fashion design students; and discuss implications about forms, materials and experiential qualities of soma-wearables.",soma-wearable design; somaesthetic practice; somatic wellbeing; style-fashion-dress
2018,Froukje Sleeswijk Visser,Structuring Roles in Research Through Design Collaboration,https://dl.designresearchsociety.org/cgi/viewcontent.cgi?article=1545&context=drs-conference-papers,"In Research through Design knowledge is generated, but not always captured and shared effectively. When working in a multidisciplinary team of, e.g. designers, design researchers, academic researchers and domain practitioners confusion about roles, processes, and results easily occurs. In a series of three Research through Design cases we developed a set of role descriptions to help structuring the collaboration in such projects, using different configurations of people, roles and documentation tools. We conclude with a structure for assigning roles that enables multidisciplinary teams to make their Research through Design process more explicit, reflect on their activities as part of process data, and propose moments to capture knowledge from all actors involved.","research through design, collaboration, design documentation"
