Publication Year,Author,Title,Url,Abstract,Keywords
2018,Sila Umulu; Fatma Korkut,I-Wonder-How:A Method for Co-designing with Children in Design Education,https://dl.designresearchsociety.org/cgi/viewcontent.cgi?article=1726&context=drs-conference-papers,"This paper explores co-designing with children in the context of undergraduate industrial design education, and investigates the potential of performative and narrative-based design methods in co-designing with children. It addresses the early phases of design process and proposes a co-design method for supporting industrial design students’ eliciting children’s needs and preferences. The field study conducted involves a co-design session with 51 industrial design students and 24 third grade primary school children, and face to face semi-structured interviews with 24 design students who participated in the co-design session. The findings indicate that the proposed co-design method, I-Wonder-How, is supportive for industrial design students in their eliciting children’s needs and preferences. Based on the challenges experienced by design students during the co-design session and the post-session design process, the study draws attention to the importance of the entire co-design experience including pre and post phases. While the pre-session phase entails preparedness of the parties involved, the post-session phase requires design students to focus on reinterpreting and reconstructing design insights.",co-design; co-designing with children; methods for co-designing with children; co- design in industrial design education
2018,Stefano Parisi; Valentina Ragnoli; Davide Spallazzo; Daniela Petrelli,"ICS Materials. Towards a Re-Interpretation of Material Qualities Through Interactive, Connected, and Smart Materials.",https://dl.designresearchsociety.org/cgi/viewcontent.cgi?article=1628&context=drs-conference-papers,"The domain of materials for design is changing under the influence of an increased technological advancement. Materials are becoming connected, augmented, computational, interactive, active, responsive, and dynamic. These are ICS Materials, an acronym that stands for Interactive, Connected and Smart. While labs around the world are experimenting with these new materials, there is the need to reflect on their potentials and impact on design. This paper is a first step in this direction: to interpret and describe the qualities of ICS materials, considering their experiential pattern, their expressive-sensorial dimension, and their aesthetic of interaction. Through case studies, we analyse and classify these emerging ICS Materials and identified common characteristics, and challenges, e.g. the ability to change over time or their programmability by the designers and users. On that basis, we argue there is the need to reframe and redesign existing models to describe ICS materials, making their qualities emerge.",ICS materials; expressive-sensorial dimension; aesthetic of interaction; materials experience.
2018,Niti Bhan; Rinku Gajera,Identifying the User in an Informal Trade Ecosystem,https://dl.designresearchsociety.org/cgi/viewcontent.cgi?article=1581&context=drs-conference-papers,"How do we identify the right target beneficiaries within an informal economic ecosystem for development interventions designed to maximize benefits and value for money? This was our initial research question when we conceived the human- centred design research program for exploratory fieldwork to map informal trade in the borderland of Kenya and Uganda. This paper narrates our discovery process and analytical journey identifying a previously unknown segment of micro-entrepreneurs whose business practices lead to the organic development of an economic microsystem - a ""value web"" or established network of customers, suppliers, and service providers. The individual actors in these microsystems collectively form a value creation engine which we identify as the target beneficiary or end-user, for the design of interventions meant to trigger progressively transformational change in the borderland's informal trade ecosystem. We describe the factors leading to our decision to consider the value creator's entire value web as the end-user, rather than the individuals at the heart of each such microsystem, for optimal outcome of systemic design interventions.","systemic design, complexity studies, design research methodology, informal economy"
2018,Jorid Vittersø; Janne Beate Reitan,"Innovation Development in Norwegian Public Schools. The relationship between innovation, creativity and imagination",https://dl.designresearchsociety.org/cgi/viewcontent.cgi?article=1727&context=drs-conference-papers,"This paper focuses on current research related to innovation development in the Norwegian public school system and investigates the relationship between innovation, creativity and imagination. Using Vygotsky’s theory of creativity, the paper describes the concept of innovation and explains how it relates to the Norwegian public school system’s creativity education curriculum. The paper explores the importance of hands-on experience and tacit knowledge when developing creativity and innovation. It explores the practice of using assessments in creative subjects and questions whether the current assessment practice allows students to truly develop creativity and innovation skills. This paper argues that although Norwegian public school teachers are knowledgeable about innovation development, the public school system lacks a concrete understanding of innovation and creativity in relation to education, as in how to teach innovation.","innovation, creativity, imagination, public school"
2018,Mariana Fonseca Braga; Francesco Zurlo,Introducing Design-Driven Innovation into Brazilian MSMEs: barriers and next challenges of design support,https://dl.designresearchsociety.org/cgi/viewcontent.cgi?article=1707&context=drs-conference-papers,"What are the barriers to introducing design-driven innovation into micro, small and medium sized enterprises (MSMEs) in mature industries through design support? What are the next challenges? This paper aims at answering these issues, proposing recommendations to overcome the barriers and exploring what is next. The research strategy was based on the analysis of two exploratory cases of design support in Brazil, taking the key stakeholders’ perspectives into account. The approach is qualitative and inductive; we analyse empirical evidence using a literature review on barriers to design-driven innovation. New constraints in the inquired contexts and the ones which were found in other studies are identified and framed at three levels: individual (actors), organisational (micro), and ecosystem. Challenges are pointed out applying the HMW framework to the most promising scenario (which considered critical variables) to design-driven innovation in Brazilian MSMEs. In addition, recommendations on more immediate constraints are suggested.",design-driven innovation; MSMEs; barriers; design support challenges
2018,Linda Shore; Adam De Eyto; Leonard O'Sullivan,Investigating Perceptions Related to Technology Acceptance & Stigma of Wearable Robotic Assistive Devices by Older Adults - Preliminary Findings,https://dl.designresearchsociety.org/cgi/viewcontent.cgi?article=1664&context=drs-conference-papers,"Longevity, and good Quality of Life enhances a positive ageing experience by post- retirement adults. However, physical decline and limitations may affect independence and autonomy to conduct and engage in day to day tasks and social activities. Assistive robots can offer support to assist, and become embodied features that are accepted and worn by older adults. To date, research is limited and little is known about older adults’ opinions of assistance by robots in personal and home life. There are a number of Technology Acceptance Models (TAMs) presenting quantitative based questionnaires that attempt to gauge acceptance and usefulness of robots by older adults. This paper presents preliminary findings from a qualitative study with older adults. The findings discussed are from an initial cohort of 8 older adult participants, which are part of a larger, ongoing study. The purpose of the study was to understand older adults’ perceptions relating to technologies commonly used and future technologies and their acceptance and usefulness. The preliminary findings are based on a cross section of eight participants, and their perceptions. The findings of the full study will inform and assist the user centred design of a soft robotic exoskeleton.",older adults; assistive robots; stigma; qualitative research
2018,Anna Whicher; Alex Milton,Journey Towards an Irish Design Strategy,https://dl.designresearchsociety.org/cgi/viewcontent.cgi?article=1578&context=drs-conference-papers,"In February 2017, the Irish Minister for Jobs, Enterprise and Innovation, launched the consultation paper towards a National Design Strategy ‘Ireland – The Design Island’ produced by the Design and Craft Council of Ireland. At the launch, the Minister, Mary Mitchell O’Connor T.D., stated that the consultation paper contained “a list of issues that need to be examined, from quick wins to long-term strategic goals” for developing Ireland’s design capacity. This political commitment to design is a significant milestone on the journey towards an Irish Design Strategy. A number of other significant steps have already taken place including the Year of Irish Design 2015 and the 2016 Policy Framework for Design in Irish Enterprises. Based on 14 interviews with a range of stakeholders across the Design Ecosystem, the authors have mapped the significant milestones in the process of developing policy actions for design in Ireland. Mapping the journey towards an Irish Design Strategy might provide insight for other researchers, policy-makers and stakeholders seeking to influence design policy.",Design Policy; Design Ecosystem; Irish Design; Innovation Policy
2018,Isabel Prochner; Anne Marchand,Learning from Feminist Critiques of and Recommendations for Industrial Design,https://dl.designresearchsociety.org/cgi/viewcontent.cgi?article=1570&context=drs-conference-papers,"This paper shows how a feminist perspective can inform industrial design theory and practice. It provides a list of feminist-informed critiques and proposals toward industrial design based on a literature analysis of existing feminist work in industrial design and analysis of three feminist-driven co-design projects. The results show that a feminist perspective identifies systemic problems in industrial design based on the presence of power and masculinity, unequal power dynamics between people and negative situations facing women. These problems appear at the multiple levels of industrial design and are a theme throughout feminist critiques in the field. In turn, feminist recommendations are typically grass roots, relying on actor interventions that draw on women’s perspectives and/or feminist perspectives. These results offer a range of contributions to industrial design. Broadly speaking, they offer an alternative perspective to industrial design to help the field move forward and respond to social imperatives. The specific critiques and recommendations can also be broadly applied, as they pinpoint problems within the field and guide alternative practices.",feminism; industrial design; literature analysis; co-design
2018,Najla Mouchrek; Lia Krucken,Living Labs in Co-Creation and Sustainability as Strategies for Design Education,https://dl.designresearchsociety.org/cgi/viewcontent.cgi?article=1718&context=drs-conference-papers,"Design schools have an important role in promoting innovation and sustainability in society. Didactic and research activities can be oriented to approach societal problems and develop solutions for specific contexts. ‘Living laboratories’ (living labs) offer significant opportunities to investigate everyday practice and collaboratively explore possibilities, by opening a space of encounter between researchers and users. This paper presents the initiative Laboratory of Design, Co-creation, and Sustainability, aimed at investigating design strategies to promote the culture of sustainability among youth. It included young design students from both university and technical secondary education. Methods involved participatory design-based analysis, context- mapping, and strategy generation. The results emphasize: a. the need to develop competencies in sustainability within design education, promoting critical thinking and ability to implement innovative solutions; b. the potential of co-creation to generate ‘contexts for change’; c. the need for more open and flexible educational approaches, allowing common sharing, engagement, self-reflection, and flexible assessment.","design education, co-creation, living labs, design for sustainability"
2018,Myrthe Montijn; Giulia Calabretta; Jeroen van Erp,Matching Data and Emotions for Designing Personalized Digital Experiences,https://dl.designresearchsociety.org/cgi/viewcontent.cgi?article=1565&context=drs-conference-papers,"Digital innovations in-store are often unnecessary, unintuitive and uncomfortable and mostly make use of personal data for one-way messaging instead of meaningful interpersonal interactions. Digital initiatives are also more focused on enhancing the shopping experience (even unsuccessfully) instead of building consumer-brand relationship through an emotional brand experience. This paper introduces a new design framework which envisions a way of using personal consumer data for the design and development of in-store digital brand touch points. The aim of the framework is to improve consumers’ in-store digital experience and their emotional connections with the brand. The foundational model for our framework is the Design for Emotion model developed by Pieter Desmet (2002). The model is used in a retail and branding context, and adapted to leverage the opportunities of personal consumer data in personalization strategies.","technology, data-driven design, design for emotions, personalization"
2018,Rosie Hornbuckle,Materials Liaisons: facilitating communication in Design-Driven Material Innovation (DDMI) projects,https://dl.designresearchsociety.org/cgi/viewcontent.cgi?article=1621&context=drs-conference-papers,"In an increasingly complex ‘problem’ landscape, interdisciplinary collaboration is becoming an important part of design practice. This paper presents research from an EU H2018 funded project which is trialling a new Design-Driven Material Innovation (DDMI) methodology. The collaborative process, involving designers, scientists and manufacturers, presents a number of language barriers. For the project to move forward, at the very least, designers need to understand the material’s potential and scientists need to understand what designers want the material to ‘be like’. The study focusses on one approach – appointing ‘materials liaison officers’ – to facilitate the interdisciplinary exchange of materials information. Drawing on interviews and workshop material the author discusses the benefits and limitations of using a ‘bilingual’ liaison to translate material understanding from one discipline to another. The findings highlight several aspects that affect interdisciplinary communication: familiarity with the material type being developed, the number of processes involved in production of the material, the approach of the designer, and the role of materials samples as boundary objects to anchor the dialogue.",design-driven material innovation; materials communication; interdisciplinary collaboration; facilitation
2018,Andy Darby; Emmanuel Tsekleves,Mentian: Developing Design Fiction for Dementia Policy,https://dl.designresearchsociety.org/cgi/viewcontent.cgi?article=1671&context=drs-conference-papers,"Acknowledging the challenges placed on healthcare by an ageing population, governments around the world are introducing policies on ageing and age-related illnesses. As emergent technologies and the UK government’s policies mix and shape our futures there are numerous potential consequences and implications for people living with dementia, their carers, families and society at large. The ‘What If?’ project investigated the use of participatory design fictions to explore the future implications of UK dementia policy. A series of codesign workshops were conducted in the UK. The authors facilitated the workshops; participants included staff from a Voluntary Sector Organisation (VSO), a group of older people assembled by the Voluntary Sector Organisation in the Northwest, and another group assembled by a community organisation. In this paper, we present the design fiction, Mentian, conceived by a participant group, the process employed in its making and offer a discussion of participant ownership of the process and the application of design fiction as a method for policy debate. Finally, we identify areas for future research.",design fiction; policy; ageing and dementia; codesign
2018,Adolphe Yemtim; Achille Sévérin Lebongo Onana; Charlotte Ray; Jamie Cross; Craig Martin; Arno G. Verhoeven,Methods Across Borders: reflections of using design-led qualitative methods in Burkina Faso,https://dl.designresearchsociety.org/cgi/viewcontent.cgi?article=1579&context=drs-conference-papers,"The paper presents an overview of activities of a funded project interrogating energy requirements of displaced populations in the Goudoubo camp in Burkina Faso. The overall project adopts a qualitative approach to enquiry using methods often employed by designers in participatory and human-centred design projects, with training provided for embedded researchers from disciplines other than design through a series of workshops prior fieldwork. The overall project aims to build a qualitative toolkit for enquiry into the daily lives of refuges and their lived energy requirements. The paper asks whether the engaged design methods, understood in the context of “global north” practices, are equally effective in sub-Saharan contexts. The paper introduces the methods used, the workshops delivered and then follows the experiences of the embedded researchers who present their findings, challenges and concerns about the delivery and implementation of “design methods” in the field. In their own voice, the researchers outline successes and failures, providing a critical examination regarding the degree to which design methods are transferrable across cultures and contexts.",qualitative methods; design methodology; energy; displacement; reflection
2018,Francesca Mattioli; Silvia Deborah Ferraris; Venere Ferraro; Lucia Rosa Elena Rampino,Mybias: A web-based Tool to Overcome Designers’ Biases in Heterogeneous Design Teams,https://dl.designresearchsociety.org/cgi/viewcontent.cgi?article=1596&context=drs-conference-papers,"Cross-cultural and interdisciplinary collaborations are increasing in all sectors, from companies to universities. As a consequence, design teams are becoming more and more heterogeneous; it thus becomes fundamental to improve teamwork for heterogeneous teams. Designer’s interpretation ability is a fundamental skill, but it might be strictly connected to the designer’s personal experience and can, therefore, be strongly biased. Are design students aware of this? If not, how can they be supported to manage diversity? In this paper, we first introduce our research that is aimed at better understanding the role of biases in the design process and in heterogeneous teams. We afterward present the development of a web-based tool designed to improve design teams’ dynamics by making students more aware of their biases from the beginning of the design process. The results of the tool testing on 79 students of two different classes of a Design Studio Course are presented and discussed.","design tool, heterogeneous teams, biases, mutual understanding"
2018,Damla Tonuk; Tom Fisher,Natural Materials – Nature of Materials,https://dl.designresearchsociety.org/cgi/viewcontent.cgi?article=1636&context=drs-conference-papers,"The material world is recently and very rapidly changing; altering the relationships between materials – the substance of everyday life – and designers – the professionals who are responsible for transforming materials into daily life objects. This vibrant context prompts us to explore and attempt to conceptualise these fluid relationships and review conceptual tools that will help to open up the scope of materials-based research in design. To address the multiple and multi-faceted relationships designers are situated in, we borrow concepts from social sciences that explore materiality within its multiple environments. We draw on conceptualisations of materials as active and as having capacities to bring about change and proliferate relations, and responding to new developments of biotic materials. By considering historic materials, particularly milk-based plastics, we propose a new category of autonomous materials. We discuss the emerging designer-material relationships with the hope of directing future enquiry into materials and discuss the implications of a new class of materials – the ‘autonomoids’ – for design research.","materials, milk plastics, biotic materials, materials-based research"
2018,Sofie Beier; Jean-Baptiste Bernard; Eric Castet,Numeral Legibility and Visual Complexity,https://dl.designresearchsociety.org/cgi/viewcontent.cgi?article=1642&context=drs-conference-papers,"To enhance the peripheral legibility of numerals we designed three versions of the digits from 1 through 9 by modifying the complexity of each numeral (equivalent to their digit skeleton) while controlling for variations in other physical parameters. Observers identified the different versions of the digits in random three-digit strings, presented within their peripheral visual field. Our results showed that the digit ‘1’ should have a narrow design without a crossbar at the bottom, the digits ‘3’ and ‘9’ should benefit from open apertures, and the digit ‘7’ should have a straight leg and no serif at the horizontal bar. The data further demonstrated that crowded digits presented in the periphery of the visual field generally profit from a short morphological skeleton. The findings can improve the identifiability of numbers for readers with normal visions as well as for readers with central visual field loss.","typefaces, numerals, legibility, inclusive design"
2018,ROCHA João,Olivetti’s New Canaan Electronic Laboratory: when design meets computing,https://dl.designresearchsociety.org/cgi/viewcontent.cgi?article=1542&context=drs-conference-papers,"The development of computer technology and its application by architectural research centres is a recent area of study. Initial research focused on the early work in design and computation that took place in university centres, their key figures and the theoretical and practical advances. Within this context, this paper aims to unveil the historical role played by the Olivetti Company and its Electronics Research Laboratory in New Canaan, US in shaping the first fully transistorized computer in the world and also in inaugurating multidisciplinary design research within the field. Founded in 1952, the laboratory worked closely with its main headquarters in Italy, introducing many technological innovations into the design process for new Olivetti electronic products. The paper draws on research conducted at the Olivetti archive, presenting a broader view of Olivetti's contribution to the field of computing and its innovative aesthetics. The work of Dino Olivetti, Ettore Sottsass and Mario Tchou was fundamental to this endeavour, anticipating what would become the concept of personal computing.","olivetti, computing, design, architecture"
2018,Dimitri Vangrunderbeek,On Connecting Form: explorations of a drawing method,https://dl.designresearchsociety.org/cgi/viewcontent.cgi?article=1637&context=drs-conference-papers,"In this paper I will reflect on how my pencil tracing drawings of second-hand furniture parts inspire to investigate the newly created form connections in these drawings. The reflections are based on the tacit knowledge that was established during the long process of developing a specific drawing method. I will elaborate on my explorations of the qualities of the forms of these objects, the compositions I make with the pencil tracings, the texture of the drawings, the specific size of the drawings and the referential qualities of the forms in the drawings. The drawing method is all about a succession of acts. I apply pencil tracing, hatching, cutting, painting and folding acts. Through association I want to look deeper into the drawing method and more specific into the inherent level of abstraction. I will reflect on the sculptural quality of the 2- dimensional drawing and elaborate on how the scale 1/1 aspect of the drawings and the connecting of the forms through tracings generate imagination of and associations with three-dimensional space. I ask myself the question how the drawing method can bring me further in the creation of new spatial entities (on the a imagined level, and on a three dimensional level) and how eventually these drawings relate back to design?","drawing act; reflection, connecting form; abstraction, space"
