Publication Year,Author,Title,Url,Abstract,Keywords
2006,Fátima Pombo; Graça Magalhães,Drawing in the project: image and object,https://dl.designresearchsociety.org/cgi/viewcontent.cgi?article=2566&context=drs-conference-papers,"The paper proposes lacemaking as a strategy to be incorporated in architectural thinking and design. It looks at the three different modes of repetition that it encapsulates (patterning, recurrence, overlaying), relating them to other visual art practices – film, fashion and fine art specially. By integrating repetition and delicacy in its own mode of writing, Lacescapes aims not only to claim for but also to enact a poetics of spatial lacemaking – one that would potentially originate soft and delicate architectural constructs.","architectural design & practice
artefact/textiles
feminism and design
interdisciplinarity
visual design research methods"
2006,H Casakin; S Kreitler,Evaluating Creativity in Design Problem Solving,https://dl.designresearchsociety.org/cgi/viewcontent.cgi?article=2544&context=drs-conference-papers,"This study focused on the assessment of creativity in design problem solving. The purpose was to examine the possibility of grounding the definition of creativity in design in parameters that may be assessed objectively. An empirical research was carried out with students of architecture from first to fifth years. Their design outputs were evaluated by expert judges. The assessment of creativity in design was based on a number of factors dealing with: fluency, flexibility, elaboration, and innovation, as well as aesthetic skills in design representation, fulfillment of design requirements, reference to context, and usefulness. Findings showed that the evaluation of creativity in design corresponds mainly to innovation. Although evaluations do not correspond to other components of creativity, such as fulfillment of design requirements, flexibility, fluency, usefulness, these were found to be important. Elaboration and reference to context were found to be relatively weaker contributors to creativity.","design evaluation, design process, architecture, creativity factors"
2006,L Niemeyer; J Esposel,Evaluation of a Product Under an Attitudinal Approach,https://dl.designresearchsociety.org/cgi/viewcontent.cgi?article=2612&context=drs-conference-papers,"The research presented in this article, performed in Brazil, consisted of the evaluation of a specific product, the shaver, through the attitudinal approach techniques. The target product was chosen because it has a clear and unambiguous main function. Besides, it used individually and frequently. Shavers are found in the Brazilian market in a great variety of models, brands and prices. We tested a sample of shavers that are for sale in most drugstores and supermarket in Brazil. All the participants were men. They were gathered according to their educational levels and kind of professional activity. The analysis of the result of the probing tools had allowed the identification of the needs and preferences of each group, and their ways of evaluating the shavers.","design, product design, attitudinal approach in design."
2006,T Binder; J Redström,Exemplary Design Research,https://dl.designresearchsociety.org/cgi/viewcontent.cgi?article=2570&context=drs-conference-papers,"Center for Design Research, Royal Academy of Fine Arts, School of Architecture, Copenhagen, Denmark Many design programmes are currently under-going radical transformations as they move towards university status. Research and research-based education becomes part of the everyday of the design school. Also in design studios and design consultancies, design research is frequently heard of as a new venue of activity. But what is design research and how does it relate to design and to the more proven knowledge production of the sciences and humanities? In this paper we will suggest some answers to these questions. In particular, we will look at what role a research program and an interventionist research strategy based on design experiments may play for the advancement of knowledge relevant to design and designers. With the notion of “exemplary design research driven by programs, experiments and interventions”, we refer to research based on the explicit formulation of design programs that act as a frame and foundation for carrying out series of design experiments and interventions. It is ‘exemplary’ in the sense that it enables critical dissemination primarily by creating examples of what could be done and how, i.e. examples that both express the possibilities of the design program as well as more general suggestions about a (change to) design practice.","design research methods, design research models, experimental design & art, interdisciplinarity, participatory design research"
2006,C Akner. Koler,Expanding the boundaries of form theory Developing the model Evolution of Form,https://dl.designresearchsociety.org/cgi/viewcontent.cgi?article=2599&context=drs-conference-papers,The design research community is beginning to recognize the organizing capacity of form as a scientific method of its own right. The aim of this study was to a) develop a pedagogically framed case study method that applied a participatory action research approach and b) create a 3-D form model bridging geometric- to organic structures. A 10-step-concept-translation-form method was developed which resulted in a “Evolution of form” model with two axes: The first horizontal axis presents a sequence of geometrically derived forms that gradually take on organic qualities of convexities and concavities. The second axis expands the model in a vertical dimension to include a bipolar spectrum at each stage. This vertical dimension opens up a dichotomy between congruent and incongruent properties in relation to original features of the geometric form. The discussion deals with the active formgiving process; the need for sculptural awareness and the inner sense of form; validity of the created method and model and finally the pros and cons of aesthetical abstractions that build on geometric references.,"art, geometry, aesthetic, perception, embodiement"
2006,K Niedderer; P Johns; C Harrison,Exploring the Creative Possibilities of Argentium™ Sterling Silver,https://dl.designresearchsociety.org/cgi/viewcontent.cgi?article=2587&context=drs-conference-papers,"This paper documents the investigation into the creative possibilities of Argentium™ Sterling Silver. The aim was to test the qualities and performance of this new material in the complex environment of practical application and to complement its scientific development with an exploration of the new artistic opportunities that it might offer. For this purpose, two designs of tableware were developed, one of which was based on using a range of traditional techniques, the other on using new technologies such as laser-welding and laser-bending. The performance of Argentium™ Silver was compared with that of traditional Sterling Silver based on the extensive experience of the artist-researcher in working with Sterling Silver. Additionally, direct comparative tests between both materials were conducted where necessary and appropriate. The outcome of this research was twofold. Firstly, it provided an assessment of the material’s qualities and performance within practical application, which allowed recommendations to be made for its use in creative practice of relevance both to makers and industry. Secondly, it showed that the utilisation of new technologies can offer new avenues for designing silver, such as the development of a new formal language which may help (re)forming contemporary views of the material silver.","craft, investigative practice, new technologies, materials research, Argentium™ Sterling Silver"
2006,Z Strickler; C Rauh; PJ Neafsey; C Lin,Formative Research for Interface Design for Older Adults: Reducing Adverse Self-medication Behaviors,https://dl.designresearchsociety.org/cgi/viewcontent.cgi?article=2619&context=drs-conference-papers,"The current project Reducing Adverse Self-Medication Behaviors in Older Adults builds on an earlier study by the investigators (Preventing Drug Interactions in Older Adults), in which a computer software program was developed to help older adults learn to avoid common, harmful, drug interactions. The program contains attractive, simplified animations demonstrating how two types of prescription medications (antihypertensives and anticoagulants) work in the human body, and how these can interact with over-thecounter (OTC) drugs and alcohol in ways that may lead to harmful health outcomes. The interface and animations were designed to be easy to use and appealing to older adults (those aged 60 and older) based on extensive, formative research into the aesthetic preferences, and visual and psychomotor requirements of this population. In a controlled, clinical trial, the program (delivered on touch-screenequipped laptop computers) was found to increase knowledge about drug interactions and perceived selfefficacy for avoiding the interactions, as well as to reduce reported harmful, self-medication practices among older adults who used the software as compared to control groups. Formative and usability research is now underway to develop a next generation interactive program that allows patients to enter their current, self-medication behaviors privately and independently on a wireless, touch-screen tablet PC. Patient-entered data are analyzed by the system so that educational content is delivered that is tailored to the patient’s particular risk behaviors. Patients use the program in a clinic waiting room prior to a visit with their care provider, and they bring a print-out of the computer session to their appointment. Thus, the PEP-NG improves patient-provider communication and practice, and makes optimal use of the patient’s and the clinician’s time.","design and information technology: interface design, information design and IT enabled, interface accessibility design;the aged; interface accessibility design; usability of information/user testing;"
2006,J. Choi; K. Sato,Framing a Learning-Based Approach to Interactive System Design,https://dl.designresearchsociety.org/cgi/viewcontent.cgi?article=2597&context=drs-conference-papers,"When users interact with an interactive system to achieve goals, their knowledge is utilized, accumulated and generated, formulating and continuously modifying their mental models of the system. This process can be considered the users’ learning process of the system. The goal of this research is to identify users’ learning process through interaction, as well as to provide system designers with the knowledge on this process, so that they can employ such knowledge into the design process. This paper, in particular, investigates the relevant literature to form the standpoint of the overall research. The survey encompasses theories and methodologies from three different research areas: Cognitive Science, which provides the foundation of the basic concepts in a human cognitive process, and Human-Computer Interaction and Artificial Intelligence, which account for the Cognitive Science theories in more applicable ways. Although the previous works provide useful insights on the process of learning through user-system interaction, there is little research on integrated methodologies that are able to incorporate users’ learning process into design practice. Therefore, this study proposes a learning-based approach to interactive system design, which involves the conceptualization of learning processes, the implementation through knowledge representation, and the validation of this methodology. By doing so, it aims to provide users with easier and richer experiences in the use of interactive systems.","design theory and methodology; learning-based approach; system design; cognitive
psychology/cognitive science; mental models"
2006,T. Christensen; J. Takamura; D. Shin; D. Bacalzo,Go With The Flo: A report on a collaborative toilet design project that utilized a transdisciplinary approach,https://dl.designresearchsociety.org/cgi/viewcontent.cgi?article=2520&context=drs-conference-papers,"The Flo toilet is a product of a transdisciplinary design process initiated by graduate students and faculty of the Industrial Design department at Arizona State University. The final product illustrates the benefits of collaboration and research. The project offers insight about bridging the gap between research and practice in the academic arena. The Flo team is composed of two graduate students and two faculty members whose experience in Industrial Design is complemented by another area of specialization. Disciplinary interests include mechanical engineering, brand architecture and design management, socio-cultural theory and empirical research, and concept generation and computing technology. In this case, Industrial Design offered a common language for the diverse disciplinary interests of the team members. During the design process, each individual brought their own expertise to empirical data collection, theoretical analysis, engineering specifications, and brand strategy. The resulting form, mechanical functioning, and brand identity of the Flo toilet represent a transdisciplinary effort. The Flo toilet is a paradigm-shifting design solution that satisfies criteria of transgenerational usability, low energy consumption, reduced water use, and innovative mechanical functioning. The interaction between graduate students and faculty also reveals new opportunities for design research in academia.","design & innovation processes, design education, human-centered design, innovative
technology and accessibility for the elderly & disabled, research and education"
2006,C Vincent; A Cole; Z Schincariol,Graphic Design and Motion Graphics,https://dl.designresearchsociety.org/cgi/viewcontent.cgi?article=2582&context=drs-conference-papers,"This paper presents an interdisciplinary experiment in Communication Design teaching. It focuses on two moments in the project’s development: print media design and its translation into audiovisual language. We begin experimenting with the expressive possibilities of typography, which add meanings to the transposition of verbal content. Interpretation and sharp perception of typography, in the technical and aesthetics aspects, interfere when generating visual composition. The expressive possibilities increase when motion and sound, which are distinctive aspects of audiovisual language, come into play. We are interested in the creative process that involves translating graphic language into audiovisual language.",typography; graphic design; Motion Design; interdisciplinary; design teaching.
2006,Bo Westerlund,How can stories get translated into future artefacts?,https://dl.designresearchsociety.org/cgi/viewcontent.cgi?article=2573&context=drs-conference-papers,"This paper discusses a workshop method suitable for use in projects with a participatory design approach. Participatory design is sometimes criticised for focussing too much on what users say. The method described here takes that into account by having users not only talk, but also do acting and make lo-fi prototypes. The method has been used in several different projects. The structure of the workshops is designed to enable the participants to express themselves by saying, doing and making. People express different aspects through different channels and by enabling people to express themselves not only by talking but also by acting and constructing artefacts we create a richer understanding of their needs and desires as well as their context and situation. The method often gives ‘good’ results that are foundations for further design work.","design process, human centered design, methods & tools for idea generation, participatory
design, workshops (for generating understanding of the design space)"
2006,P.k. Storkerson,How to Develop Basic Research in Communication Design,https://dl.designresearchsociety.org/cgi/viewcontent.cgi?article=2576&context=drs-conference-papers,"As a matter of competence and legitimacy, Communication design needs the grounding and knowledge that come from basic research. One of the major impediments to basic research in communication design is the lack of theoretical frames by which to apprehend and isolate valid, significant research questions and define research methods. This paper explicates these problems and proposes solutions by outlining a process of defining theory and method and by proposing a specific ontological and epistemological frame within which to conduct research in communication design.","communication, cognition/perception, semiotics, interpretation"
2006,J L Allen,Human augmentation: transference of design approaches from designing for sports to designing for disability,https://dl.designresearchsociety.org/cgi/viewcontent.cgi?article=2541&context=drs-conference-papers,"This paper begins by considering the dichotomy between the design of sporting goods and the design of disability products, with an intent to identify some ways in which disability products can become more socially acceptable and even desirable. The role of material artefacts in the creation and propagation of individual- and social-identity is discussed in an attempt to highlight the importance that design can have in ameliorating self-image and public-image of people with disabilities. The paper goes on to discuss a design project carried out in two parts in an Undergraduate Industrial Design studio class to explore the notion of augmenting human ability. The first part of the project focused upon sporting goods and the opportunities therein to enhance human performance and safety within a chosen sport. The second, mirroring and applying the learning from the first part, explored the opportunities to enhance human ability of those considered to be elderly or those who have a disability. The paper focuses upon three case studies of disability products and concludes that there can be positive transference of design approaches from designing for sports to designing for disability.","design and disability, design for all, design/product semantics, industrial design education, innovative technology and accessibility for the elderly and disabled"
2006,B. Hanington,Human Centering Design Across Dimensions,https://dl.designresearchsociety.org/cgi/viewcontent.cgi?article=2583&context=drs-conference-papers,"The uneven application of human centered research and design across disciplines is evident in both practice and education. In particular, graphic or communication design is much less familiar than industrial or interaction design with human research and testing. The underlying human criteria for design activity should know no dimensional boundaries. The creation of printed material to convey information, digital interfaces for devices or web-based interactions, and three-dimensional products and environments, all share a foundation of human use. There is no reason why any design discipline should be disadvantaged in the sensitivity to human factors, and therefore in the exposure to the necessary tools for responsible design activity. Coinciding with a significant curriculum review, an introductory human factors course previously required only of industrial design undergraduates is now also required of communication design students. The first test-run of the original course taught to all students demanded some significant changes, and the course was revised with new content and format, recognizing the needs of a much larger and more diverse audience. The instructor assesses the revised course in the context of wider curriculum reviews and the changing nature of design boundaries, through outcomes and reactions of the class, and reflections.","design education, human centered design, industrial design, graphic design, communication
design"
2006,S C Coxon,Industrial Design as contributor to relieving child anxiety in the course of MRI scanning procedures.,https://dl.designresearchsociety.org/cgi/viewcontent.cgi?article=2538&context=drs-conference-papers,"Magnetic resonance imaging (MRI) is now a widely used diagnostic imaging procedure that has been employed throughout hospitals all over the world for over twenty years. MRI technology allows doctors and specialists to examine internal parts of the human body such as the brain and spinal chord, without invasive procedures. Studies show that children frequently find MRI scanning daunting and occasionally frightening despite the examinations non-invasive qualities. The principle contributors to this negative experience have been identified as the sterile ambiance of the hospital environment, the claustrophobic tunnel or bore that the patient lies within, the overly warm temperatures, high noise level and especially the requirement of the patient to remain absolutely still for prolonged periods of time. Approximately twenty undergraduate students undertaking the Bachelor of Industrial Design programme at Monash University where engaged in a collaborative research project to take an industrial design methodology in creating a more child friendly approach to this issue of child anxiety during an MRI procedure. Their solutions were inventive and wide ranging in outcome stimulating discussion within the medical discipline concerning this very real issue. The aspiration of this project is that these design concepts will stimulate further research leading to evaluative building and testing in the future.","Methods, Industrial Design, Magnetic Resonance Imaging, Children"
2006,N Morelli,Industrialisation and Social Innovation: Design in a New Context,https://dl.designresearchsociety.org/cgi/viewcontent.cgi?article=2546&context=drs-conference-papers,"Many years ago, Viktor Papanek urgently called for a radical revision of the design profession, based on an exploration of new territories outside the market oriented logic. For many years Papnek’s call was ignored, but the problems he emphasised became more and more evident. Globalisation requires industrial production to adopt complex strategies that mix action at the global and the local level. While industrial production is globalising, local needs are becoming more and more complex, generating demand patterns and opportunities, often ignored by the mainstream market-oriented perspective. Papanek’s proposal was revived some years ago, with the Common Ground conference. Starting from this event, other contributions were proposed that revised the relationship between designers and their main clients and found new methodological approaches. This debate represents the theoretical and logical framework for this paper. An investigation is proposed, beyond the traditional links between design and industry, emphasising new insights on the changes in the social role of industrial production. Furthermore the paper proposes a methodological exploration to help designers focusing on new actors and new perspectives in search for possible convergences between the logic of socially responsible design and the contribution of the industrial culture.","Social Context, industry, social system design, design and sustainability"
2006,Daniel Pinkas; Jean-Louis Boissier; Sidonie Carrillat; Annelore Schneider; Pius Zoll,Integrated Descriptive Interactivity for Complex Collections (IDI),https://dl.designresearchsociety.org/cgi/viewcontent.cgi?article=2623&context=drs-conference-papers,"IDI (Integrated Descripttive Interactivity for Complex Collections) is a media design research project currently conducted at the Haute école d’arts appliqués, Geneva (HEAA). IDI explores the descriptive potential of interactive video and seeks to integrate video-interactivity into a comprehensive descriptive and documentary approach to complex collections. An integrated descriptive interactivity aims at providing an intuitive account of the user’s relations to the objects or elements of a complex collection. We must emphasize that our project goes well beyond a simple combination of existing media; it seeks a new documentary modality which allows the user to browse through a collection not only by selecting items satisfying chronological, linguistic or analytical criteria, but also by selecting sensitive or formal properties belonging to the interactive rendering itself. We assume that the experimental protocols developed and tested for a contemporary art collection during the first phase of our research will find suitable applications for many different types of complex collections. This project is co-financed by the CTI/Swiss innovation promotion agency. MAMCO - Museum of Modern and Contemporary Art in Geneva is our partner.","descriptive interactivity, chrono-video animation, complex collections, media integration, database."
